SerialNo,Session_Summary,BERT_Feature_0,BERT_Feature_1,BERT_Feature_2,BERT_Feature_3,BERT_Feature_4,BERT_Feature_5,BERT_Feature_6,BERT_Feature_7,BERT_Feature_8,BERT_Feature_9,BERT_Feature_10,BERT_Feature_11,BERT_Feature_12,BERT_Feature_13,BERT_Feature_14,BERT_Feature_15,BERT_Feature_16,BERT_Feature_17,BERT_Feature_18,BERT_Feature_19,BERT_Feature_20,BERT_Feature_21,BERT_Feature_22,BERT_Feature_23,BERT_Feature_24,BERT_Feature_25,BERT_Feature_26,BERT_Feature_27,BERT_Feature_28,BERT_Feature_29,BERT_Feature_30,BERT_Feature_31,BERT_Feature_32,BERT_Feature_33,BERT_Feature_34,BERT_Feature_35,BERT_Feature_36,BERT_Feature_37,BERT_Feature_38,BERT_Feature_39,BERT_Feature_40,BERT_Feature_41,BERT_Feature_42,BERT_Feature_43,BERT_Feature_44,BERT_Feature_45,BERT_Feature_46,BERT_Feature_47,BERT_Feature_48,BERT_Feature_49,BERT_Feature_50,BERT_Feature_51,BERT_Feature_52,BERT_Feature_53,BERT_Feature_54,BERT_Feature_55,BERT_Feature_56,BERT_Feature_57,BERT_Feature_58,BERT_Feature_59,BERT_Feature_60,BERT_Feature_61,BERT_Feature_62,BERT_Feature_63,BERT_Feature_64,BERT_Feature_65,BERT_Feature_66,BERT_Feature_67,BERT_Feature_68,BERT_Feature_69,BERT_Feature_70,BERT_Feature_71,BERT_Feature_72,BERT_Feature_73,BERT_Feature_74,BERT_Feature_75,BERT_Feature_76,BERT_Feature_77,BERT_Feature_78,BERT_Feature_79,BERT_Feature_80,BERT_Feature_81,BERT_Feature_82,BERT_Feature_83,BERT_Feature_84,BERT_Feature_85,BERT_Feature_86,BERT_Feature_87,BERT_Feature_88,BERT_Feature_89,BERT_Feature_90,BERT_Feature_91,BERT_Feature_92,BERT_Feature_93,BERT_Feature_94,BERT_Feature_95,BERT_Feature_96,BERT_Feature_97,BERT_Feature_98,BERT_Feature_99,BERT_Feature_100,BERT_Feature_101,BERT_Feature_102,BERT_Feature_103,BERT_Feature_104,BERT_Feature_105,BERT_Feature_106,BERT_Feature_107,BERT_Feature_108,BERT_Feature_109,BERT_Feature_110,BERT_Feature_111,BERT_Feature_112,BERT_Feature_113,BERT_Feature_114,BERT_Feature_115,BERT_Feature_116,BERT_Feature_117,BERT_Feature_118,BERT_Feature_119,BERT_Feature_120,BERT_Feature_121,BERT_Feature_122,BERT_Feature_123,BERT_Feature_124,BERT_Feature_125,BERT_Feature_126,BERT_Feature_127,BERT_Feature_128,BERT_Feature_129,BERT_Feature_130,BERT_Feature_131,BERT_Feature_132,BERT_Feature_133,BERT_Feature_134,BERT_Feature_135,BERT_Feature_136,BERT_Feature_137,BERT_Feature_138,BERT_Feature_139,BERT_Feature_140,BERT_Feature_141,BERT_Feature_142,BERT_Feature_143,BERT_Feature_144,BERT_Feature_145,BERT_Feature_146,BERT_Feature_147,BERT_Feature_148,BERT_Feature_149,BERT_Feature_150,BERT_Feature_151,BERT_Feature_152,BERT_Feature_153,BERT_Feature_154,BERT_Feature_155,BERT_Feature_156,BERT_Feature_157,BERT_Feature_158,BERT_Feature_159,BERT_Feature_160,BERT_Feature_161,BERT_Feature_162,BERT_Feature_163,BERT_Feature_164,BERT_Feature_165,BERT_Feature_166,BERT_Feature_167,BERT_Feature_168,BERT_Feature_169,BERT_Feature_170,BERT_Feature_171,BERT_Feature_172,BERT_Feature_173,BERT_Feature_174,BERT_Feature_175,BERT_Feature_176,BERT_Feature_177,BERT_Feature_178,BERT_Feature_179,BERT_Feature_180,BERT_Feature_181,BERT_Feature_182,BERT_Feature_183,BERT_Feature_184,BERT_Feature_185,BERT_Feature_186,BERT_Feature_187,BERT_Feature_188,BERT_Feature_189,BERT_Feature_190,BERT_Feature_191,BERT_Feature_192,BERT_Feature_193,BERT_Feature_194,BERT_Feature_195,BERT_Feature_196,BERT_Feature_197,BERT_Feature_198,BERT_Feature_199,BERT_Feature_200,BERT_Feature_201,BERT_Feature_202,BERT_Feature_203,BERT_Feature_204,BERT_Feature_205,BERT_Feature_206,BERT_Feature_207,BERT_Feature_208,BERT_Feature_209,BERT_Feature_210,BERT_Feature_211,BERT_Feature_212,BERT_Feature_213,BERT_Feature_214,BERT_Feature_215,BERT_Feature_216,BERT_Feature_217,BERT_Feature_218,BERT_Feature_219,BERT_Feature_220,BERT_Feature_221,BERT_Feature_222,BERT_Feature_223,BERT_Feature_224,BERT_Feature_225,BERT_Feature_226,BERT_Feature_227,BERT_Feature_228,BERT_Feature_229,BERT_Feature_230,BERT_Feature_231,BERT_Feature_232,BERT_Feature_233,BERT_Feature_234,BERT_Feature_235,BERT_Feature_236,BERT_Feature_237,BERT_Feature_238,BERT_Feature_239,BERT_Feature_240,BERT_Feature_241,BERT_Feature_242,BERT_Feature_243,BERT_Feature_244,BERT_Feature_245,BERT_Feature_246,BERT_Feature_247,BERT_Feature_248,BERT_Feature_249,BERT_Feature_250,BERT_Feature_251,BERT_Feature_252,BERT_Feature_253,BERT_Feature_254,BERT_Feature_255,BERT_Feature_256,BERT_Feature_257,BERT_Feature_258,BERT_Feature_259,BERT_Feature_260,BERT_Feature_261,BERT_Feature_262,BERT_Feature_263,BERT_Feature_264,BERT_Feature_265,BERT_Feature_266,BERT_Feature_267,BERT_Feature_268,BERT_Feature_269,BERT_Feature_270,BERT_Feature_271,BERT_Feature_272,BERT_Feature_273,BERT_Feature_274,BERT_Feature_275,BERT_Feature_276,BERT_Feature_277,BERT_Feature_278,BERT_Feature_279,BERT_Feature_280,BERT_Feature_281,BERT_Feature_282,BERT_Feature_283,BERT_Feature_284,BERT_Feature_285,BERT_Feature_286,BERT_Feature_287,BERT_Feature_288,BERT_Feature_289,BERT_Feature_290,BERT_Feature_291,BERT_Feature_292,BERT_Feature_293,BERT_Feature_294,BERT_Feature_295,BERT_Feature_296,BERT_Feature_297,BERT_Feature_298,BERT_Feature_299,BERT_Feature_300,BERT_Feature_301,BERT_Feature_302,BERT_Feature_303,BERT_Feature_304,BERT_Feature_305,BERT_Feature_306,BERT_Feature_307,BERT_Feature_308,BERT_Feature_309,BERT_Feature_310,BERT_Feature_311,BERT_Feature_312,BERT_Feature_313,BERT_Feature_314,BERT_Feature_315,BERT_Feature_316,BERT_Feature_317,BERT_Feature_318,BERT_Feature_319,BERT_Feature_320,BERT_Feature_321,BERT_Feature_322,BERT_Feature_323,BERT_Feature_324,BERT_Feature_325,BERT_Feature_326,BERT_Feature_327,BERT_Feature_328,BERT_Feature_329,BERT_Feature_330,BERT_Feature_331,BERT_Feature_332,BERT_Feature_333,BERT_Feature_334,BERT_Feature_335,BERT_Feature_336,BERT_Feature_337,BERT_Feature_338,BERT_Feature_339,BERT_Feature_340,BERT_Feature_341,BERT_Feature_342,BERT_Feature_343,BERT_Feature_344,BERT_Feature_345,BERT_Feature_346,BERT_Feature_347,BERT_Feature_348,BERT_Feature_349,BERT_Feature_350,BERT_Feature_351,BERT_Feature_352,BERT_Feature_353,BERT_Feature_354,BERT_Feature_355,BERT_Feature_356,BERT_Feature_357,BERT_Feature_358,BERT_Feature_359,BERT_Feature_360,BERT_Feature_361,BERT_Feature_362,BERT_Feature_363,BERT_Feature_364,BERT_Feature_365,BERT_Feature_366,BERT_Feature_367,BERT_Feature_368,BERT_Feature_369,BERT_Feature_370,BERT_Feature_371,BERT_Feature_372,BERT_Feature_373,BERT_Feature_374,BERT_Feature_375,BERT_Feature_376,BERT_Feature_377,BERT_Feature_378,BERT_Feature_379,BERT_Feature_380,BERT_Feature_381,BERT_Feature_382,BERT_Feature_383,kmeans_cluster,TSNE_1,TSNE_2,agglo_cluster
11,"problem with heatmap is that they don't capture sufficient information but they play important role when we have multiple parameters and it is not feasible to plot all parameters therefore heatmap helps in pair wise analysis.variance influence factor explain a parameter based other all other parameters excluding itself cif  is xi=f( xj not equals xi ) indentify the vif of the features of the vif is greater than threshold then remove it principle component analysis is an application of singular value decomposition principle component are necessarily orthogonal to each other and can be equal to the dimension of the data but if we have for say 10 principle component we can decide which parameters we will choose to continue with if we have 2 dimensional data and we do pca then it may get converted to one dimension hence help in reducing the dimensionality of the data pcs are the weighted sum of all the parameters and the weights are known as loading in general vif needs to do first as multicollinearity is a big problem than pca . pca helps you with predictions but we cannot do what if/ sensitivity type of analysis like how much u changes when we change a x(parameter) as they are not real parameters. pca has  multiple uses dimension reduction , prediction models ,  visualization( during eda) for the purpose of understanding the data , captures variance , data reduction ( data compression without loosing too much of data ), it is sensitive to data scaling therefore we have to normalize the data , tsne  follows t distribution it is stochastic in nature and gradient descent is involved in this , it is a lossy transformation ( we loose exactness of data  but we get relative closeness of the data )",0.037881695,0.006437955,0.040732842,0.0006480518,0.017137876,0.04343731,-0.029141312,0.004726935,0.019491106,0.03542233,-0.028542055,-0.028609185,-0.0016767391,0.024793062,0.03546296,-0.011918391,0.07482019,0.048838437,-0.080953754,-0.0047400934,0.03790118,-0.058414537,-0.10381861,-0.023407947,-0.0912291,0.040332187,0.030967472,0.020106466,-0.043137453,0.07850583,0.058489487,0.06541618,-0.07058422,-0.03961283,-0.01981788,0.02379229,-0.019613717,0.004939746,-0.098671906,0.040591445,0.0047792885,0.045997772,-0.033421412,0.054046817,0.11038932,-0.032756016,-0.029091239,-0.09352522,-0.0389802,-0.041459214,-0.019627146,0.022902275,-0.034978103,0.04404952,-0.0018931864,0.0001049013,-0.019156957,-0.080562145,0.02341885,-0.025929961,-0.05043814,-0.01459874,0.000603208,-0.07365014,0.10133442,0.009380528,0.01797322,-0.011048633,0.006703537,0.03990499,-0.027147494,0.015555702,-0.003490953,-0.055990145,0.0027723988,0.03919061,-0.024995526,0.007135021,0.057574417,-0.06452172,0.11005803,0.10350653,-0.005921201,-0.031716384,-0.044202756,0.0042840494,-0.0038053088,-0.103757136,0.02850202,0.0425185,0.076617435,0.106363304,0.02478903,0.007504736,0.056622673,-0.04683486,0.030064736,-0.065013334,0.049273428,-0.037914183,0.0039601754,-0.058170192,0.013686281,0.013962111,-0.02586402,-0.06382446,-0.041458745,-0.04011187,0.019015431,0.007130082,-0.038882807,-0.014354486,-0.08111212,-0.038598284,0.099273495,-0.05043773,0.033657975,0.06507485,0.034756932,0.004571963,-0.049264956,-0.11761718,0.07747465,0.0045713396,0.099549405,-0.025038527,-0.10842563,1.02352086e-32,-0.056809835,0.06106756,-0.052332353,0.029347107,-0.010482479,-0.022830272,0.024333512,-0.112384036,0.039897893,0.0075235222,-0.0006317165,0.0828844,-0.003467173,0.06280455,0.038790673,0.04329577,0.03399985,0.04086411,-0.06489237,-0.06586908,0.043512333,0.011277971,0.15774249,0.013128643,0.014883099,-0.092594944,-0.056887385,0.0252244,-0.08157776,-0.017863212,-0.02447891,0.008610935,-0.109613486,0.029843284,-0.021618025,-0.047996968,-0.029724626,-0.05381777,0.027539385,-0.019450326,-0.03038156,-0.0063702217,0.080811,0.007602955,-0.009838045,0.026594525,-0.009848569,-0.0019990942,-0.03035758,-0.032532066,0.0029148178,0.011822292,0.051917545,-0.052776568,-0.05530462,0.014417206,0.030982455,-0.06342041,0.03069885,-0.02715039,-0.13871418,-0.05310526,-0.010240638,-0.068264924,0.03795077,-0.036639452,-0.039072093,-0.024014123,-0.005165202,-0.04375522,-0.03364342,0.009047414,-0.025414245,-0.06287904,0.05779803,-0.07051161,-0.025109107,0.08169701,-0.056739487,0.111688726,-0.13853097,0.02279767,0.056672905,-0.04649951,-0.001263812,-0.1214623,0.043209396,0.013893395,-0.028300626,-0.08191495,-0.06548033,0.076110356,0.04298065,0.07653819,0.056747504,-9.984197e-33,-0.08140475,0.012266245,0.028006531,0.09442231,0.010201624,-0.05034073,-0.049191132,-0.06884784,0.025791906,-0.07640795,0.050868727,-0.06250448,-0.0038502424,-0.04934764,0.05140033,0.10134395,-0.03940707,-0.0044950657,-0.031202976,-0.0014510683,-0.018539472,-0.050262306,-0.03484802,0.018656136,-0.06431199,-0.06970335,-0.019607447,-0.09329548,0.0045933006,-0.0001589692,-0.055434983,0.045378186,-0.036234505,0.05371719,0.031986218,-0.02397744,0.019327328,-0.029935883,0.041326907,0.07017766,0.0154357795,0.08984494,0.018889703,-0.00067975017,-0.031589404,0.010150632,0.09311677,0.017190922,-0.013538228,0.06492242,0.13985641,0.02526749,0.013290776,0.029109428,0.054092303,0.008371833,0.09068556,-0.022064619,0.044339117,-0.03506738,0.059212197,-0.0315302,-0.00562475,0.020561958,-0.009873181,0.06630964,0.06819984,-0.05449611,0.027965719,-0.038594384,-0.0028469143,-0.010439237,0.027040849,0.006468921,0.0101461075,-0.105779625,-0.0052234423,0.0383244,0.008940067,0.015188093,0.03926168,0.005724686,0.020916827,-0.023933765,0.0022556358,0.102561146,0.05292044,-0.047790747,-0.0027180917,-0.008669011,0.060904477,-0.036190666,0.014904106,0.11208906,0.0410451,-5.8930485e-08,-0.047027934,-0.07108253,-0.0037021034,-0.10592635,0.047589753,-0.12175857,-0.0031550413,0.06588976,0.06433853,0.09012137,0.07564874,0.028060261,-0.02228925,-0.0064544757,0.06542029,0.0053994763,0.046888493,0.016643561,-0.0091814725,0.011508877,0.037246726,-0.039735764,-0.035525445,0.030343773,0.12626371,-0.01609056,0.031539973,0.014384693,0.024029905,0.02905776,-0.01373074,-0.045907784,-0.021101907,0.0052416106,0.0065328362,0.02575316,0.11523035,-0.07240036,-0.058386575,0.05195299,-0.018293975,0.028255347,0.0041802926,-0.017939862,0.037146214,0.019891782,-0.03608947,-0.049541425,0.014951001,0.08156511,-0.055287942,0.00036842196,-0.0022530404,0.039781146,-0.037024613,-0.02619496,0.012739649,0.060777724,0.062136848,-0.039445914,0.034305938,-0.016148413,-0.06833936,-0.07390294,2,20.252968,14.660987,11
99,"we learned that if we have a large number of features, then the correlation matrix is a good way to understand the pairwise relation between the parameters. 
then we compared the variance inflation factor(vif) of all the parameters.
then we aimed to reduce the parameters to reduce the complexity and computation power. we can do it by calculating the vif and removing parameters that have very high vif values. this helps reduce the complexity by minimal change in the model's accuracy.
then we studied principal component analysis. the no of principal components is equal to the dimensions of the dataset. all the principal components are orthogonal to each other.
then we understood the elbow diagram and came to know how many principal components are actually required to have a 95% confidence interval. we then accordingly removed features to simplify the dataset.
we then had a discussion about which thing to do first, vif or principal component analysis. we came to the conclusion that doing vif first is beneficial because multicollinearity is important to remove. 
also, we saw that we can write y as a function of principal components.
we do principal component analysis for three main reasons- dimension reduction, prediction models, and visualization.
then we had a look at t-distribution and t-distributed stochastic neighbour encoding(t-sne). it is a machine-learning algorithm for dimension reduction and data visualization. its main advantage is the ability to preserve local structure.",0.059809785,-0.052502792,0.0067961263,-0.025619488,0.0108995335,0.019823734,-0.049214642,0.007811426,0.090047516,-0.0028829356,0.030268317,0.025343662,-0.04722633,0.053531773,-0.02226095,-0.049042773,0.058794502,0.02607011,-0.071105905,-0.012757262,0.011533219,-9.023884e-05,-0.0014486128,-0.03122078,-0.010426592,0.020759882,0.007596614,-0.0018099092,-0.01517877,-0.0046955883,0.032491777,0.070693985,-0.0109851835,-0.045208458,-0.08652597,0.0067472314,0.10805216,0.07165456,-0.06337409,0.04636452,-0.003028535,0.06218622,0.042007033,0.07031032,0.11105594,0.045575432,-0.03235294,-0.073217034,0.0037849816,-0.03908036,-0.054660533,0.043931715,-0.07903124,-0.016766885,-0.03637935,-0.034098394,-0.022987202,-0.10454104,-0.031678434,0.024807213,0.0011501105,-0.011142037,0.022525767,-0.01003355,0.113505825,-0.020677418,0.007316183,-0.04941298,-0.009087029,0.03206954,-0.09021299,0.0002555274,-0.086620264,-0.015785785,-0.034496915,0.10132011,-0.04825966,0.0055629946,0.05315945,-0.019089205,0.07008203,0.16531797,0.0066610184,0.040692173,0.0074505345,0.040398955,-0.010477648,-0.032982852,-0.106841445,-0.013701134,0.13803837,0.039999697,0.012339544,-0.056590363,0.042975634,0.085931934,0.0033953746,-0.103381835,-0.025105348,0.008752322,0.018016277,-0.073629685,0.09223256,-0.02165653,-0.08206358,-0.057385314,0.00832485,0.038290538,0.032880522,-0.02987833,-0.01841273,-0.015006526,-0.107267134,0.0061829435,0.058601033,0.05584152,-0.0587975,0.039344456,0.11281724,0.03666493,-0.017997304,0.03988358,0.052984297,0.03907036,0.024744881,0.027265973,-0.107231624,5.090323e-33,0.031848453,0.047863916,-0.00856989,0.019972695,-0.043765165,-0.002207402,0.04147771,-0.073035,0.07980585,0.070649415,-0.055551495,0.022170257,-0.005961137,0.05112368,0.02847618,0.0017505345,-0.019414352,0.048603963,-0.024731385,-0.054460317,0.080845326,-0.031259842,0.07374588,0.03569793,-0.020483663,-0.0372824,-0.023247097,-0.010511141,-0.10447887,-0.017037679,-0.09093838,0.096955456,-0.0909214,0.05355493,-0.03108775,-0.11394152,-0.0026062543,-0.09205182,0.0708086,-0.036255658,0.010440528,0.035391748,0.017177984,-0.02528905,0.03667958,0.06713174,0.028919103,0.009652459,-0.017830873,0.023794847,0.015113216,0.04399289,0.02729831,-0.04129434,-0.033175018,0.091354564,0.007882973,-0.052478936,-0.017200809,0.015526238,-0.112140924,0.008134973,-0.03513728,-0.03616701,-0.04126467,0.016806176,-0.07076721,0.0031847341,0.024355914,0.0031313433,-0.05323491,-0.04773475,-0.024638323,-0.07779606,0.016174,-0.053924404,-0.0436291,0.07784553,-0.007741892,-0.007601462,-0.1015972,0.07223635,-0.0057975105,-0.033439,0.07962989,-0.04721895,0.08619215,-0.0428294,-0.008734657,-0.054789044,-0.004950123,0.08074014,0.048017845,-0.006347179,-0.0035322881,-4.449897e-33,-0.021110104,-0.00019428157,0.014089552,0.035594482,0.028080773,-0.10235393,-0.024189858,-0.060892396,0.008503589,-0.13854256,0.03499925,-0.04437111,-0.025980065,-0.037643995,0.08357037,0.066588484,-0.013910331,-0.029577216,-0.0037666874,-0.054853324,0.024841668,-0.039600078,-0.0057352437,-0.057536628,-0.049541395,-0.045320373,-0.002926119,-0.0696202,-0.053945553,-0.0053427494,-0.07872601,0.016856786,-0.0601273,0.04991804,-0.0027002401,-0.017153561,-0.057818547,-0.046183378,0.022813665,0.03466056,0.054643646,0.049291193,0.008819547,-0.051533796,-0.009227826,-0.0063609355,0.03362665,0.020969728,-0.02218172,-0.005901743,0.029529534,0.029203437,0.05310316,-0.0409457,-0.0052721696,0.0233217,0.13119948,-0.045652017,0.11030874,-0.003357659,0.025963869,-0.00053551316,-0.054959416,0.013488949,0.027639775,0.0032198983,0.049144868,-0.04424407,-0.014406604,0.004539465,0.0012885225,-0.010787606,0.059543617,-0.05583617,-0.019102143,-0.039863937,-0.017100973,-0.017911304,0.009250773,0.030042144,-0.029203797,0.010620689,-0.012985208,0.0039009978,0.01651279,0.10140547,0.032037996,-0.028800623,0.047186036,-0.005816578,-0.008655258,-0.019044058,0.01700066,0.07819967,0.050738934,-6.074541e-08,-0.07511929,0.025616642,-0.045986675,-0.0798981,0.059622698,-0.018337369,-0.0036205812,0.16737477,0.036014616,0.063077085,0.16348226,-0.033616174,-0.078540795,0.039886992,0.08273693,0.015402397,0.037589807,0.07295936,-0.02759418,-0.07906796,0.08929473,-0.07368664,0.011238877,0.02012284,0.07490558,-0.03273509,0.037270848,0.086505994,0.024167053,0.05333773,-0.03669975,-0.072758794,0.035499133,0.004993004,0.021937992,0.03189936,0.031351812,-0.03353742,-0.011960386,0.013151685,-0.082191385,0.061051443,-0.013431344,-0.016367292,0.072160885,0.012102926,0.020008985,0.03593332,0.009431074,0.03807509,-0.04272816,0.01343958,-0.026555266,0.10351437,-0.035352387,0.022117943,0.029130924,0.024377735,-0.07107528,0.004310139,-0.0033041362,0.032474753,-0.059164517,-0.0554381,2,20.072412,17.1349,11
100,"today covered principal component analysis (pca) and its role in simplifying data while keeping the most valuable information. we started by looking at why itâ€™s important to remove correlated factors using the variance inflation factor (vif) before applying pca. from there, we explored how principal components (pcs) capture variance and how the elbow method helps determine the right number of pcs to use. we also discussed practical applications, like using pca for exploratory data analysis (eda), improving predictive models, and making data easier to interpret. a comparison between standard regression and principal component regression highlighted how pca can enhance model performance. we wrapped up by discussing its real-world impact and why itâ€™s such a useful tool in data analysis.",0.008047753,-0.024277253,0.0021081262,0.034636892,0.07867081,0.04875456,-0.017358705,-0.009681631,0.06790043,0.034707684,0.03144409,0.08198746,-0.074700475,0.035147555,-0.03182741,-0.041537073,0.07526443,-0.007948717,-0.055824444,-0.04080809,-0.0192542,-0.024042048,-0.052527867,0.02198949,0.024860883,0.0651434,0.013264799,-0.018679142,-0.031155804,0.023870755,0.029821288,0.060220517,0.015310678,-0.035973065,-0.085997544,0.019425457,0.06614877,0.08856014,-0.07886944,-0.01604351,0.02480608,-0.009604993,-0.011092569,0.042278893,0.13405578,-0.01668074,-0.038426243,-0.07863699,0.025345068,-0.0006278398,-0.0353135,-0.032085724,0.03778562,-0.016482932,-0.03157435,-0.007900322,-0.0034133866,-0.020672126,0.034122963,0.023783997,-0.023291701,-0.032881323,0.017775837,0.02004139,0.06917274,-0.040206518,0.016910793,-0.010804012,-0.06852268,0.0072970698,-0.07836095,0.06139781,-0.054849736,0.0200278,0.041225124,0.08437766,-0.052360244,-0.030513441,0.09347017,0.026460374,0.022551518,0.113827206,-0.03877434,0.017443115,0.02100598,0.030211791,0.036827322,-0.07055731,-0.06541389,-0.0020943691,0.08944357,0.058243837,0.08501128,-0.0045724106,-0.008461971,0.03347587,0.014144294,-0.09989433,-0.010538624,0.02681946,0.017235164,0.020301023,0.01752397,0.0121944435,-0.09162127,-0.12656237,0.036164597,0.009406278,0.033782862,0.0030170244,-0.04861756,-0.017094966,-0.051472332,-0.04894007,0.073745206,-0.04645282,-0.007931313,0.033394836,0.037816692,0.030521344,0.004526302,-0.0376057,0.058104992,0.039163142,0.054502916,0.021492146,-0.09062472,6.1047595e-33,0.054798722,0.014598411,0.015591392,0.012838766,-0.0011517857,-0.07804901,-0.0052506193,-0.048617862,0.07830393,0.056523647,0.012056542,0.0954762,-0.014588984,0.04550238,0.04100905,0.028268266,-0.0637247,0.11884153,-0.011800269,-0.010280408,0.07378906,-0.08215873,0.053165175,-0.047736626,-0.030472498,0.010466987,-0.0341946,-0.013860654,-0.00767858,-0.010860437,-0.033749018,0.020227447,-0.08359193,0.031140657,-0.057272304,-0.06312616,0.022556903,-0.12483348,0.10762163,0.024623029,-0.025651779,0.028767003,0.039999917,-0.08081793,-0.03887311,0.0708703,0.0056740995,-0.049360447,0.00920586,0.033133794,0.035741575,0.037942305,0.009588512,-0.0007858186,-0.078512624,0.08328484,0.010860579,-0.09531425,0.029440481,-0.04980449,-0.09488478,0.06279883,-0.006324695,-0.046015576,-0.07284403,-0.062004298,0.050858267,0.052386932,-0.023396796,0.011590596,-0.030129028,-0.0412498,-0.034695353,-0.022775969,0.019027213,-0.06878829,-0.02865283,0.0043442277,-0.0012129253,0.0017874804,-0.063611716,0.050243836,0.040321995,-0.07576745,0.038742933,-0.065789275,0.017000357,-0.09857565,-0.015888158,-0.08199752,-0.03869638,0.06482174,0.04133026,-0.0038465308,0.014875052,-5.8533646e-33,-0.054979682,0.025146987,0.017397286,0.044986088,0.046064742,-0.08391465,-0.031919897,-0.02202439,0.02852852,-0.07228986,0.034229048,-0.030114537,0.016076166,0.039329514,0.119034395,0.05791419,0.00450005,-0.027021509,-0.028931208,-0.09285284,-0.017759483,-0.097095706,0.020002488,-0.051375553,-0.043546442,-0.06470065,-0.009593203,-0.05841344,-0.053409804,-0.09433765,-0.071158536,0.07075993,-0.06181663,0.04708312,-0.039603896,0.0010406524,-0.076498345,-0.081570424,0.017928585,0.0614915,0.10417778,0.05962172,0.009728388,-0.011242715,-0.031693812,-0.032385238,0.036499944,0.08674331,0.04334197,0.03874815,0.03469214,0.03402343,0.024193956,-0.01780649,0.015343388,-0.021892522,0.14448012,-0.039283823,0.035268497,0.026350873,0.048400406,0.008820557,-0.03292788,0.043320447,-0.014932141,-0.040818356,0.036935464,-0.060333177,-0.062201288,-0.02513865,0.044911914,-0.027635427,-0.012993989,0.037734173,-0.060204968,-0.029225226,0.0015698681,0.01677373,0.01782822,0.03918811,0.0083678765,-0.031599216,0.045151804,-0.10263226,0.017998623,0.098596066,0.036193058,-0.021239808,-0.024499714,-0.0075687794,-0.11288446,-0.012903881,-0.009196812,0.075747795,0.0036196637,-4.6480118e-08,-0.047570992,-0.0013099342,-0.004753755,-0.025051724,-0.018841654,-0.056837466,0.0009153029,0.123156585,-0.0001222816,0.0138939945,0.12519929,-0.07504093,-0.09655371,0.06699432,0.09455388,0.072212756,0.04936406,0.06514172,-0.045880146,-0.038935963,0.03868831,0.05491344,-0.04791028,-0.054311443,0.08835942,-0.033394076,0.027628673,0.19141975,0.036239274,-0.0037245601,-0.00018921398,-0.0042182603,-0.0080818385,-0.034837738,0.009953185,0.066707395,0.07830892,-0.012820943,0.001397007,0.016317287,-0.11318658,0.024172993,-0.05638453,-0.009150141,0.0019831038,0.08353113,-0.032872573,0.0009421798,-0.023356628,-0.015565658,-0.016717833,-0.06640675,0.037009753,0.025857255,0.04691132,0.06642024,0.035339706,0.069856256,-0.0024838955,-0.017812716,-0.007778034,-0.0049901456,-0.040186137,0.02356897,2,18.113459,17.87493,11
