547,"we first did a comparative study
 between features and r-squared where we want to reduce the number of features because of the difficulty presented by dimensionality.
principal component analysis (pca) uses singular value decomposition (svd). in a data set with variables x1 and x2, it is feasible to obtain as many principal components (pcs) as the number of dimensions, i.e., pc_1 and pc_2, which are orthogonal to each other. the direction of these principal component axes is so oriented that the first component explains the maximum variability, and the next components explain successively less variability. at first, this is a two-dimensional problem, and pca successfully simplifies it into one dimension.  pca reduces the dimension of the data set. it is necessary to calculate the variance inflation factor (vif) before pca is applied. while principal components increase predictive power, their interpretability is severely compromised. ""what-if"" analyses are not possible with principal components since they are not real features but mathematical entities used for prediction. therefore, tracing predictions back to the original variables is compromised when pca is used.
pca is also used in exploratory data analysis (eda), which dictates the choice between going for ordinary regression or pca regression.
limitations of pca are its interpretative difficulties. but one strong point is that it can be used to visualize large datasets because the original data, which might have many dimensions (columns), can be reduced very much using the corresponding principal components.
another well-known dimensionality reduction method is t-distributed stochastic neighbor embedding (t-sne), which compares t-distribution with gaussian normal distribution. t-sne is a probabilistic method.
the process of converting raw data to labeled data through t-sne is achieved by developing a probability distribution for every data point that reflects its closeness to all other points in the dataset. in high-dimensional spaces, gaussian normal distribution is used, while t-distribution is used in low-dimensional situations. the probability of a point being close to another is highlighted in t-sne over its gaussian equivalent.",0.011744611,-0.008968925,0.013319475,0.008718021,0.029214326,0.022468181,-0.067206286,-0.0074695214,0.07985071,0.0074542775,-0.019663716,0.045079995,-0.04893012,0.09460823,-0.018397305,-0.023751007,0.06765984,0.07588093,-0.06804752,0.03935517,0.08622383,-0.042206656,-0.08637117,0.04339887,0.024145186,0.061961547,0.036788475,-0.019702975,-0.028862286,0.022672135,0.06254802,0.08010484,-0.04230444,-0.08816838,-0.03653857,0.06580894,0.042476688,0.13006435,-0.082837425,-0.0015447338,0.03173627,0.04722085,-0.0009422263,0.05325107,0.06518634,-0.009981167,-0.037061296,-0.07880906,-0.024259033,-0.025561968,-0.023670202,-0.0053229528,-0.05226087,-0.003896921,-0.00300144,-0.069152266,-0.019192921,-0.0010331912,0.017957753,0.04361013,0.00019268034,-0.014682202,0.051105507,-0.020940509,0.034233425,-0.04130975,0.019905841,-0.027606403,-0.028221944,0.053117286,-0.047695663,0.038950663,-0.07059732,-0.0041290936,-0.0045493525,0.031361967,-0.004405433,-0.014245878,0.05746778,-0.01314965,0.06309746,0.109601915,-0.055424187,-0.026547788,-0.012981328,0.01689837,0.0407008,-0.06536671,-0.07558406,0.052469723,0.06476736,0.061402585,0.10140401,-0.039768178,0.028826965,-0.013476165,0.060491435,-0.09000133,0.06390235,-0.0021321545,0.025042549,-0.0064261686,0.027719576,0.004320562,-0.0039296793,-0.09215391,-0.043017678,-0.035087805,0.045935147,-0.03848008,0.003937408,-0.010621556,-0.077214554,-0.003739688,0.054921065,0.021680336,0.00013494356,0.05611731,0.059635125,0.023847131,-0.023763394,-0.07890527,0.07986265,0.020284554,0.12025065,0.013091334,-0.100862786,7.0636506e-33,0.010290872,0.0497562,-0.06624245,0.02985116,-0.03274067,-0.051599048,0.031590465,-0.029137667,0.14396739,0.095145985,-0.024366446,0.038466252,0.009341035,0.013731426,0.041590918,0.06102322,0.014986452,0.04430447,-0.00866542,-0.039414506,0.06848622,-0.060260866,0.091321364,-0.018747821,-0.01763761,-0.09238767,-0.051928625,-0.03668855,-0.06809668,-0.039483026,-0.02964913,0.019532694,-0.03919188,0.08109852,-0.05685245,-0.0976605,0.043949675,-0.07692346,0.09936125,-0.0021033345,0.014536894,0.0001940974,0.021905702,-0.015735298,0.019503575,0.040010292,0.048139103,-0.022299007,-0.06549104,0.01733791,0.019257447,0.057211287,0.020223668,0.0076148,-0.025756106,0.020109883,-0.017471455,-0.07878778,0.025094546,-0.022265246,-0.09796992,0.027097039,0.017363923,-0.0691501,-0.032848243,-0.09856631,0.051377337,0.02207022,-0.02680131,0.0034512214,-0.042523205,-0.069134675,-0.0013377058,-0.07966261,0.030044116,-0.055629816,-0.003070118,0.027235638,0.009136097,0.034158524,-0.11029167,0.08511748,0.029226242,-0.065698475,0.022299198,-0.060980503,0.021383226,-0.08582754,-0.04547478,-0.08757658,-0.062233027,0.04919052,0.073736094,-0.007949,0.028573819,-6.794861e-33,-0.09530205,0.034231097,-0.007187132,0.02949843,0.010115568,-0.062050723,-0.042548273,-0.023594586,-0.007837596,-0.13906334,0.0075907744,-0.0418564,-0.0050129155,0.036901478,0.061462402,0.099961974,-0.010819952,-0.008698324,-0.06191259,-0.024310723,-0.028317569,-0.059263326,-0.042111494,0.010946368,-0.0141914,-0.04964423,0.023148872,-0.112111464,-0.008026693,-0.045070834,-0.053853054,0.077984735,-0.061110973,0.08655843,-0.023055965,-0.047871724,-0.06736453,-0.12650244,-0.009499251,0.10815122,0.072913386,0.09219075,0.01722509,0.016121771,-0.035008915,-0.07901295,0.06046088,0.063755445,0.052780796,0.029228348,0.042437147,0.041306496,0.04892039,0.021041663,0.03316129,-0.0008808578,0.078557916,0.0065190294,0.08183793,0.022122161,0.07753034,-0.08749004,-0.021626709,0.037429903,-0.027810898,0.027645167,0.047421794,0.027300376,-0.04204978,0.007062541,0.027882837,-0.06417118,-0.025146589,-0.007867731,-0.054172415,-0.08212596,-0.0035217653,-0.029612135,0.021805894,0.021245249,0.07057285,0.046008382,0.032142278,-0.06086409,0.00023337145,0.11970018,0.02332247,0.01357391,0.010378958,-0.046395227,-0.01281248,0.001678999,-0.016767928,0.08969879,0.083456606,-5.639141e-08,-0.055674333,-0.032458574,-0.020723602,-0.06883455,0.029983265,-0.115662746,-0.041545417,0.09866789,-0.0062211067,0.04520273,0.06345432,-0.019501137,-0.08515374,0.00400329,0.056253012,0.07440965,0.021964328,0.038637385,-0.015754167,0.006810647,0.030709628,-0.01526408,-0.0723067,-0.031920463,0.049108163,-0.05635362,0.047582697,0.11159194,0.071164005,0.06617721,-0.018715406,0.008497231,0.027791174,-0.026403906,0.0068200855,0.017428318,0.10171878,-0.0069899675,-0.042663965,-0.00081914227,-0.05084805,0.020231202,-0.027970659,-0.019152842,0.022783784,0.04882723,0.027679773,-0.027353598,0.0063179987,0.004846817,-0.044356793,0.0048942664,0.01016404,0.031680763,0.03790396,0.036963042,-0.06150083,0.08213428,0.01065025,-0.044035934,0.0006507318,0.015045453,-0.037948184,-0.059550077,2,17.20946,15.099052,11
557," in today's class, we continued the discussion of vif, in which we saw that if a feature's vif value is high, then that feature is highly dependent on other features. vif is used for determining multicollinearity. in vif analysis, we set up a threshold, any feature having vif above it can be removed. then we move onto principal component analysis(pca), in which we plot vif against r^2. we see that the principal components are orthogonal to each other. as the number of principal components increases, the number of dimensions in the data also increases. pc are the axis which captures the best variance in the data. the function y=f(x) can be interpreted as y=f(pc) and it has mainly two uses, for prediction and answering what-if type questions. pc analysis can be used for data reduction, dimension reduction, in prediction models, and visualization in eda to understand the structure of data. pca is sensitive to data scale and hence we need to normalize the data. we saw two examples of this in the class, in which the blood parameter data was one. at last, we see about t-sne, which is t-distribution schematic neighbour encoding, which is a lossy transformation and helps mapping of multi-dimensional data to one-dimensional or two-dimensional data.",-0.01293898,-0.03503786,-0.01953815,-0.056270745,0.032524776,0.032246552,-0.03951715,0.06255616,0.05929963,0.047528956,-0.0014692142,0.067876615,-0.114644416,0.084431216,-0.0392825,-0.049768113,0.05791485,0.048614863,-0.12801212,0.031334464,0.02698391,-0.003993144,-0.03785585,0.034851216,-0.008117544,0.01020034,-0.02272684,0.018977962,-0.015307093,0.0140959155,-0.0066444306,0.10713901,-0.0018137402,0.015225062,-0.07631148,-0.0007874378,0.031755384,0.051351428,-0.10006266,0.01982475,-0.019313032,0.008537728,-0.031345915,0.052053243,0.09247669,-0.021317286,-0.031589627,-0.12600549,0.02405102,-0.063697964,-0.0068714065,0.05329504,-0.1169104,0.03155923,-0.0025560078,0.015671177,0.011440275,-0.08631703,0.014956898,6.744944e-05,-0.014542987,0.003539838,0.05356336,0.007121913,0.097747736,-0.040690295,0.017543413,-0.05055323,0.0012797446,-0.009342953,-0.08970889,0.019232197,-0.02950393,0.00030141394,-0.006826285,0.052207433,-0.03371523,0.017711917,0.06888209,-0.04735757,0.078386955,0.091080286,-0.02606356,0.019826699,0.03865003,0.030061215,-0.011218167,-0.0871331,-0.014307878,0.025405204,0.09821008,0.048828557,0.034240093,-0.014223046,0.032868028,-0.03263076,0.014580073,-0.0929947,0.048993208,0.02838019,-0.028437661,-0.06482024,0.06640825,0.048182584,-0.025669612,-0.075082034,0.0179678,-0.003332987,0.05538511,-0.0216834,-0.03905219,0.041698,-0.07614974,0.0212881,0.08061338,-0.015100512,-0.02659595,0.075224414,0.04924601,0.013818507,-0.037355468,-0.084325045,-0.0014339839,0.041551895,0.046598956,0.04121574,-0.042598914,3.4099464e-33,0.03202703,0.031728864,0.0040533687,0.02596398,-0.07006828,-0.023691785,0.005813158,-0.025167158,0.044242755,0.092642665,-0.06154024,0.032563247,0.055458132,0.091257975,-0.00469526,0.0008241516,0.015805867,-0.0125500625,-0.005259,-0.023161035,0.11201461,-0.0018325801,0.109696664,-0.025674665,-0.06601025,-0.105739966,-0.11367435,-0.056978274,-0.063122414,-0.0056772335,-0.12726848,0.031994354,-0.011803324,0.03717703,-0.00825347,-0.053352717,0.021320313,-0.08711345,0.0783071,0.0191155,0.03962309,0.029771682,0.04858052,-0.07292144,0.009203903,0.049714446,0.02718981,0.031486295,-0.06451944,-0.005962655,-0.013581559,0.01875754,0.018681876,-0.044303086,-0.009977129,0.083976746,0.059193626,-0.05609029,-0.05222909,0.018901989,-0.08189374,0.02526143,0.018894056,-0.06337646,-0.030646816,-0.05702924,-0.049815103,-0.056731045,0.014749893,-0.023768079,-0.034749553,0.042590402,-0.054318823,-0.0977974,0.04014581,-0.018632285,-0.07922485,0.038288612,0.005142767,-0.029077398,-0.117212795,0.07615379,-0.0016078912,-0.03737797,0.020145155,-0.086174466,0.037359983,-0.108286954,-0.003121775,-0.097787134,-0.011547656,0.034163605,0.05186821,-0.031626802,0.048101503,-4.426902e-33,-0.07406403,0.04932886,-0.09215837,0.09275051,0.041461866,-0.016354756,-0.02458433,-0.047316168,-0.006728954,-0.076615475,0.061029486,-0.033836443,0.016415915,-0.0727202,0.05895483,0.06313313,-0.042851076,-0.03727253,-0.06424221,-0.054744005,-0.009765649,-0.026376126,0.029632851,0.0068754014,-0.0039421543,-0.029093746,-0.038752817,-0.064152844,-0.031174637,-0.008361414,-0.044316866,0.061747916,-0.038149502,0.05464991,0.024382118,-0.0016568066,0.020510163,-0.08674612,0.015202857,0.050700713,0.037746575,0.10592792,0.067168094,-0.0005718811,-0.05889736,0.0020507693,0.053361673,0.08855032,0.029341538,-0.0069798282,0.040748328,0.023894249,0.052902386,0.032911997,-0.020204779,0.057354406,0.06732249,-0.026816135,0.018237349,0.048497837,0.07510819,-0.006953352,-0.07708168,0.06494555,-0.031195268,0.04304594,0.03505343,-0.020004053,0.02491667,-0.053804595,0.027444443,-0.015862714,0.032118876,-0.04374469,-0.069134854,-0.11296235,-0.00433732,-0.05563341,0.00929416,0.05466918,0.019729251,-0.04323515,0.040065955,0.011270584,-0.048747495,0.03062044,0.032210305,-0.007860443,0.036367234,-0.04156552,-0.006832015,-0.034750387,-0.11940247,0.05250136,0.0961553,-5.628297e-08,-0.058287047,-0.042012893,-0.036586504,-0.051587116,0.029163962,-0.13280472,0.03270703,0.10594905,0.022875533,0.09256201,0.079898976,-0.008590001,-0.06719228,-0.037134178,0.100578204,0.06661614,0.048035983,0.047415704,-0.042544443,0.027250357,0.066703714,-0.056879938,-0.040836,-0.04274708,0.047963202,-0.032498725,0.0021186532,0.09528951,0.050406758,0.03367207,0.030627076,-0.004688472,0.010693829,0.009414604,-0.012568151,0.043040343,0.0709018,-0.007665481,-0.033905894,0.040046457,-0.04031281,-0.017040493,-0.03130343,-0.01009516,0.070353046,0.06562769,0.021298083,0.014604485,0.032000702,-0.0076383306,-0.05422289,0.07682489,-0.005397839,0.060602758,0.0010401955,0.023914032,-0.011489702,0.04854796,-0.0019267478,-0.05213103,-0.0038360842,0.022823757,-0.01554411,-0.09411879,2,18.874414,15.479741,11
562,"we started the lecture where we left off last time, discussing about the vif values and the iterative procedure of finding the most independent features. we understood that the threshold value chosen should have some justification. we then moved on to pca i.e. principal component analysis. we discussed that pca helps us to reduce the dimensionality of our problem, by somewhat changing the axes of our data such that each axis helps to describe the maximum variance in the data. thus pc1 axes captures maximum variance, pc2 captures the next maximum variance and so on. a simple example could be a two dimensional linear data, which could be reduced to one dimension by taking the axis along the line. we need to check how many principal components we need in order to explain majority of the variance of the data. each principal component is a linear combination of each of the original features. the coefficient of each feature in the linear combination, is known as loadings. now in between pca and vif, the vif procedure should be done first as it eliminates multicolinearity which is a bigger issue. also, pca hinders with our interpretability as the features are not what they actually meant, but a combination of multiple features. however, pca does help us in dimension reduction, for making good predictions and also in visualisation and understanding the structure of the data. when used for visualisation, pca becomes a part of eda. pca requires normalisation of the data. if pc1 and pc2 cover 70 to 80 percent of the variance of the data, then the multidimensional data can be visualised in two dimensions by plotting the data on a pc1 vs pc2 plot. now for better visualisation, we have another tool called tsne. tsne is a lossy transformation which helps us to visualise our data in two dimensions. it is based on the t-distribution and also uses gradient descent, and is hence slow and not consistent. tsne calculates a probability distribution of all the other points being close to one certain point. it does this for each and every point. this data is taken into a matrix and then the dimension is reduced. tsne means t-distributed stochastic neighbour encoding. t-distribution helps us to magnify the difference between the points if there exists any, and thus helps in classification and clustering. ",0.025996577,-0.061217774,0.036032118,-0.071849555,-0.0062062833,-0.00025744905,-0.03117231,0.005896871,0.029261835,0.010524689,-0.048548345,0.03734067,-0.09973165,0.07608378,-0.018551739,0.023282105,0.084283635,0.045165863,-0.03896763,0.037313625,0.02592836,-0.04847471,-0.047279224,0.057184048,-0.032800123,0.05961987,-0.0056029926,0.0028221232,0.024016984,0.03125923,0.03670048,0.05808059,0.0073763607,-0.029365132,-0.009817266,0.033537596,-0.023469,-0.0022952077,-0.053635526,0.019238107,-0.0008231269,0.062033456,-0.023640111,0.043417178,0.085188255,0.040530425,-0.034010008,-0.11802536,0.036130827,-0.047841802,0.01520573,0.028527146,-0.05007156,0.0055492404,-0.05160877,-0.055690944,0.038288593,-0.07338794,0.05073054,0.0049246405,0.001970864,-0.0028887712,0.05171398,-0.012164628,0.10265304,-0.0032075904,0.00059300265,-0.019755417,-0.042602938,0.04726079,-0.083361395,0.019020125,-0.029676376,0.012400442,-0.012754095,0.07892964,-0.04488962,0.0042186663,0.03819006,-0.049261253,0.039695844,0.104536764,0.01347715,-0.010486199,-0.004533177,-0.023883682,0.012018219,-0.090649515,-0.01012126,0.033543237,0.06646201,0.08106166,0.09400782,0.0085363565,0.049725536,-0.013556874,0.045903344,-0.11815764,0.061000027,0.0151800215,-0.041206,-0.052671194,0.06330599,0.019952776,-0.038385686,-0.07628823,-0.044723604,-0.016440848,0.012380113,-0.03206085,-0.0015872486,0.012738103,-0.05230957,-0.034585252,0.12079259,0.014583908,-0.0041200025,0.12924488,0.063697994,0.0023467944,-0.051773444,-0.13905711,0.032602213,0.028151331,0.09159875,0.037269365,-0.054282226,5.3045e-33,0.016681787,0.029475212,-0.019506408,-0.005410212,-0.06714718,-0.014714413,0.0527353,-0.07409061,0.068113655,0.10411497,-0.056515474,-0.021302683,0.0228176,0.040948004,0.03205599,0.014289932,0.029473037,-0.009386551,-0.03308547,-0.06684007,0.06628044,-0.053935375,0.13902137,-0.024695355,-0.04234039,-0.13499719,-0.09670545,-0.05988318,-0.08144377,-0.032915127,-0.06549268,0.016142603,-0.024429116,0.07831911,-0.05395589,-0.09381249,0.04312877,-0.07248109,0.09651682,0.02942902,0.03463145,0.0051114922,0.081553295,-0.052023295,-0.028697075,0.059700523,-0.029280962,-0.01020261,-0.0644679,0.018372584,-0.020157853,0.04073041,0.013964899,-0.028315082,-0.055580974,0.0015414105,-0.00062143494,-0.09038792,0.01434408,-0.017336871,-0.035409775,-0.03920447,-0.006249081,-0.030190207,0.024152331,-0.08441754,-0.0025221636,0.024288902,-0.009155864,0.0055765593,-0.07087335,-0.019973222,-0.029397957,-0.12983444,0.030502448,-0.047128554,-0.015801147,0.055889115,0.008159081,0.007673048,-0.09809328,0.10203542,0.0041513834,-0.048864596,0.042505346,-0.01448019,0.047016077,-0.11987448,-0.035630725,-0.07595643,-0.03179263,0.023766132,0.09843109,0.008617521,0.023616621,-5.2693635e-33,-0.020358307,0.059453044,0.025618583,0.03927471,0.035272572,-0.024749244,-0.06495088,-0.07053162,-0.04587314,-0.047780696,0.021959871,-0.025630794,-0.014338661,-0.028920658,-0.008265562,0.06667342,-0.011480211,0.0050536,0.0030610156,-0.024314526,0.023586115,-0.06505435,-0.029130416,0.034436624,0.012527176,-0.05517921,-0.0006878156,-0.08870436,-0.017680585,-0.03227041,-0.04052231,0.101226605,-0.03723224,0.10107266,0.040469434,-0.010748615,-0.024829326,-0.0860191,0.037041664,0.10281921,0.06210147,0.04185106,0.0079526035,0.018411785,-0.04395562,-0.042072717,0.05152815,0.10000618,-0.0066767223,0.0021016344,0.06486997,0.06757867,0.068709284,0.041187182,0.057298444,0.03979738,0.09128338,-0.036894757,0.094179146,-0.03257155,0.03924133,0.00057411083,-0.061677795,0.021893593,0.011572147,0.0455107,0.07421193,-0.02562509,-0.027336814,-0.018049652,-0.027426427,-0.035871275,0.0540433,-0.04751972,-0.0056226817,-0.0794565,-0.012899456,-0.045641575,0.018765232,0.0016941257,0.035796873,-0.057448853,0.04074126,-0.0318534,0.009094776,0.10064799,0.018480247,-0.053964123,0.038643345,0.003649809,0.015358659,-0.011213945,0.009680552,0.058874935,0.07434947,-5.6516296e-08,-0.05673315,-0.055852033,-0.087921254,-0.105637155,0.08896345,-0.07055218,-0.0002491165,0.09091036,-0.0042866482,-0.007955554,0.09547942,-0.031035153,-0.057909947,0.039359596,0.05159854,0.081650935,-0.0014581055,0.07416768,-0.0102433665,0.051733043,0.018469406,-0.052019805,-0.008450558,-0.068007074,0.032991372,-0.06604252,-0.0026908692,0.08869853,0.079210736,0.059201654,0.032708764,-0.044173025,0.009588128,-0.042264078,0.022716625,0.055335987,0.049073562,-0.025774302,-0.03068318,0.021491434,-0.036183972,0.016213799,-0.0038173844,-0.01553454,0.01830615,0.07902796,-0.024152473,0.019418415,0.025161887,-0.02917392,-0.027379893,-0.030736027,0.03698603,0.08845847,-0.020214407,0.049777642,-0.013907609,0.087094165,0.026576577,-0.059887063,-0.0039831996,-0.019328061,-0.034159318,-0.08849208,2,18.742912,14.352518,11
575,"the session highlighted the use of principal component analysis (pca) in feature reduction, focusing on dimensionality reduction while retaining the most variance. a brief introduction was provided on the need to remove correlated factors using vif before pca can be performed. the applications of pca included visualization (eda), embedding in prediction models, and analysis of the structure of data as a comparison between classic regression models and pc regression, improved interpretability, and computational efficiency. this includes how to extract the pcs and how to determine the number of pcs by the elbow method. then, the session efficiently packs out with the role of pca in the analysis of real-world data and predictive modeling workflows.",0.06724012,0.010960391,0.038458966,-0.004872984,0.056698255,0.033548143,0.0054993853,-0.032007236,0.006626591,0.043011367,0.00648747,0.060909603,-0.054643985,0.055706035,-0.057566293,-0.03483644,0.029349785,0.02827163,-0.03824789,-0.050585248,0.016621148,-0.010471223,-0.019553654,0.033388156,0.017696742,0.03787367,0.056146357,0.016664684,-0.054165978,0.031968027,0.019746395,0.080665745,0.054895453,-0.06895845,-0.07239096,-0.013746016,0.025213901,0.08061737,-0.082370184,0.030302387,-0.019431965,-0.011222014,-0.032487664,0.02936679,0.10391894,0.05741867,-0.056450553,-0.11872025,0.011746994,-0.0071120914,-0.058406286,0.0033902049,-0.05461126,0.03631453,-0.04037382,-0.036135048,3.7127065e-05,-0.045773607,0.06521869,0.035373785,0.0038448086,0.0048936536,0.039061666,0.014854852,0.07868337,0.0023655654,0.0042054416,0.0051315837,-0.015599334,-0.040055327,-0.06530316,0.023757521,-0.06591342,-0.0151999425,-0.017212344,0.056932848,-0.027248349,-0.013542655,0.07919917,0.015849758,-0.005765007,0.118431516,-0.015254167,-0.010904294,0.008670118,0.077403046,0.016973795,-0.09048355,-0.056356408,-0.004852891,0.032071814,0.05985481,0.050424494,-0.029896883,-0.03495957,-0.027352415,0.046387374,-0.097890854,-0.014357069,0.04411217,0.012226214,-0.00059271243,0.060324404,0.014182515,-0.05390404,-0.076157026,0.03220145,-0.00050239445,0.01419755,-0.027564567,-0.057245027,0.029464554,-0.06796737,0.020382479,0.050035015,0.0033745246,-0.013687498,0.05885757,0.03305967,0.06354256,0.03281334,-0.04063665,0.073669285,0.018456953,0.05654577,0.01902347,-0.06663654,4.6613178e-33,0.028020851,-0.009132173,-0.039372765,-0.006368872,0.049430095,-0.03635998,0.0012478334,-0.039102063,0.08652581,0.061739687,-0.057128537,0.04967,0.018541018,0.07120989,0.015584638,0.024364028,-0.016863136,0.0977416,-0.03801341,-0.010314977,0.029340997,-0.067453474,0.06390271,0.0014525539,-0.03039905,-0.02325919,-0.048910137,-0.027343249,0.0074387183,-0.011341894,-0.055587087,0.038818635,-0.101705015,0.0092758,-0.059072442,-0.0880483,-0.015730519,-0.07628263,0.100497335,0.035529558,-0.023964807,-0.005926125,0.008159915,-0.0647933,-0.028313486,0.06193458,0.0375474,-0.029421186,-0.024972351,0.03211399,0.039797336,0.036640313,0.03210841,-0.0026483496,-0.08461587,0.047406625,0.06639531,-0.055743437,-0.0028502343,-0.0064595197,-0.08286635,0.05507198,-0.004534524,-0.067792356,-0.049580675,-0.10604252,0.03282892,0.053895336,-0.0025054684,-0.038658977,-0.04121182,0.0002999451,0.00589478,-0.052106835,0.0048040813,-0.03514568,-0.030018872,0.064995356,-0.025366884,0.039381087,-0.080387235,0.099415824,0.020572253,-0.07411161,0.10960762,-0.087702416,0.03715285,-0.08957136,-0.034072816,-0.08254866,-0.057366036,0.07715801,0.029378066,0.0022834542,0.023660485,-3.6054844e-33,-0.06789782,0.09932241,0.003160641,0.044326283,0.01734058,-0.06261037,0.015193796,-0.0026444762,0.0058527817,-0.051410425,0.07899771,-0.08044848,0.028342022,-0.019667016,0.086072996,0.06470033,-0.008884249,-0.037834547,-0.047441363,-0.036112208,-0.029072955,-0.061223473,0.037852667,-0.042270895,-0.037538465,-0.065898515,0.027095642,-0.091069855,-0.02417389,-0.08731474,-0.039745327,0.03273261,-0.10928495,0.08487679,0.0053166295,-0.030381823,-0.07618835,-0.032790743,0.009625215,0.07580639,0.10633923,0.0261346,-0.05438145,0.0010030925,-0.041061748,-0.028928204,0.034451693,0.082581386,0.043233167,0.026542692,0.028062988,0.050866134,0.0018473465,-0.030717688,0.042279053,-0.023432098,0.15440643,-0.034404047,0.048982237,-0.021061784,0.069965295,-0.01795301,0.022625478,0.036702145,0.021085141,0.004040578,0.043769795,0.06019032,-0.04810108,-0.045769095,0.0054200618,0.013013647,0.039518993,0.026195893,-0.022448713,-0.092466116,0.0057382216,-0.010251233,0.03748004,-0.0065982053,0.010927791,-0.062915005,0.02048533,-0.049495798,-0.002055684,0.12820032,-0.018434605,-0.021135788,0.03892555,-0.0067115286,-0.03850602,0.030271295,-0.03817946,0.12785417,0.051485296,-4.4809845e-08,-0.034978967,-0.008022702,-0.015598912,-0.042640705,-0.011609269,-0.07174272,-0.0038670541,0.16796109,-0.0010977939,0.016744336,0.10820554,-0.09072768,-0.08194804,0.07697592,0.079508014,0.02681951,0.036677457,0.08794813,-0.032544687,-0.05135948,0.08773748,-0.028091071,0.0011596271,0.014164304,0.07031987,-0.07716455,0.02033982,0.12999451,-0.034213632,-0.035271343,0.037908923,0.007835813,-0.0010037298,-0.047490843,0.038994145,0.06301338,0.07850716,0.024747338,-0.02827656,0.06321317,-0.12734139,0.00024144514,-0.067802556,-0.0041350396,0.05150657,0.06173537,-6.803835e-05,-0.06761411,0.044808757,-0.020147648,-0.028606007,-0.047586635,0.071606584,0.04657211,0.004336924,0.08547262,0.047085684,0.05612045,0.010039184,-0.055550035,-0.06296917,-0.0073307743,-0.04465231,-0.020523395,2,18.431055,18.534279,11
