227,"today in class, proff started by discussing about heatmaps which is used to help visualize relationships between multiple parameters. then we discussed about variance inflation factor(vif) which is used to detect multicollinearity. the higher value of vif for a particular feature suggest that it should be removed from the model in order to improve the model's performance. then we discussed about pca ( principal component analysis) is based on singular value decomposition of matrix and transforms correlated features into orthogonal principal components. pca can reduce dimensionality visualisation and prediction but does not take sensitivity into account which makes normalisation neccessary.",0.05867957,-0.068597935,-0.050443295,-0.006064517,0.06716716,0.015608066,-0.04181062,-0.06463682,0.027716875,0.04594835,0.02247881,0.009660064,-0.08008292,0.07810348,-0.061115794,-0.027214285,0.019259939,0.05983646,-0.06929523,-0.038623277,0.0120283235,-0.017497664,-0.10358306,-0.02604779,0.013244517,0.057186622,0.026249878,0.024584807,-0.03540015,0.034736495,-0.009410551,0.08195752,-0.036698025,-0.042940646,-0.0035037426,0.024523139,0.044280957,0.0844529,-0.10737993,0.031962335,0.013234418,0.0020449616,0.016188355,0.018196465,0.12600453,-0.005706414,-0.080155954,-0.07912878,0.0685434,-0.04021366,-0.053509165,-0.028971838,-0.08941684,0.012875788,-0.033969905,0.00063721504,-0.0012827651,-0.10414696,0.02750009,-0.012477061,-0.05342805,0.04653799,-0.008556046,-0.0073998454,0.14730658,-0.015280092,-0.028905569,-0.031057633,-0.014560959,0.0053168586,-0.08099465,0.018625807,0.0033823983,-0.079555795,0.010666897,0.08053889,-0.095341176,-0.0449864,0.088541895,-0.047250737,0.060040385,0.07899204,9.45501e-05,-0.053120337,0.027594427,0.007676026,0.01526418,-0.096308276,0.0104896445,0.019948646,0.08892023,0.06816578,0.008220715,-0.022701012,-0.0608321,0.014125445,0.035599586,-0.0623903,0.02977953,0.006931791,0.00021670552,-0.09514531,0.071621664,0.07475876,-0.036269084,-0.05323174,0.048482493,0.027448915,0.011713191,-0.039501913,-0.062197104,0.006921591,-0.08745828,-0.038337704,0.034190014,-0.008767729,0.019956756,0.022198537,0.06699054,0.02351141,-0.050668824,-0.030836884,0.07618639,0.059020113,0.05904644,0.022087662,-0.059141133,7.043199e-33,0.036995735,0.04794316,0.01671146,-0.007864686,-0.052532237,-0.0127396,0.0025599897,-0.070308685,0.10346323,0.019415554,0.03055716,0.09454365,-0.020987397,0.08371743,-0.039254766,-0.02381795,0.044879075,0.054448523,-0.020736372,-0.04184981,0.045032162,0.016361305,0.06466956,-0.046100754,-0.023589076,-0.017639294,-0.061697304,0.005328809,-0.0564159,0.022898562,-0.016887935,0.05840962,-0.08680113,0.011057213,-0.09571767,-0.019699587,-0.008513589,-0.07231575,0.101419516,-0.026777335,-0.022853984,-0.028677654,0.047508445,-0.036380373,-0.04911961,0.09029948,0.061699476,0.021818684,-0.052952375,-0.022520652,0.00091161963,-0.008263719,-0.015572672,0.0036040272,-0.015939763,0.06469631,0.04573969,-0.089703485,0.0010686533,-0.042403072,-0.121725485,0.047280665,-0.049742945,-0.083742045,-0.06816359,-0.064641945,-0.013238491,0.014401123,0.029354474,0.025875822,-0.04262208,-0.014348902,0.004950714,-0.04978529,0.0029905357,-0.00965765,-0.014644994,0.061150126,-0.03297557,0.0020584299,-0.08289888,0.04971251,0.035184998,-0.06136772,-0.004104647,-0.062939234,0.0057759695,-0.05251592,-0.028913898,-0.10013185,-0.010115364,0.074755475,0.059775017,0.024964932,0.016274529,-7.7813744e-33,-0.05775964,0.021864772,-0.010984256,0.105717145,0.036475237,-0.086685844,-0.052515402,-0.04197482,-0.013347023,-0.072580025,0.09135316,-0.08504499,-0.040947024,-0.036825404,0.10166972,0.06784859,-0.008386803,0.0052628405,-0.0053853183,-0.041237444,-0.04199019,-0.023854332,-0.037430122,-0.016449282,-0.06351881,-0.06348073,-0.0032773789,-0.12247881,-0.0791411,0.03024383,-0.07098863,0.07018603,-0.021065675,0.06040859,0.007104027,-0.023837294,-0.041760568,-0.055959415,0.011168634,0.062924996,0.018639931,0.07505865,0.020543411,0.00040997355,-0.0057045245,-0.02059345,0.07278427,0.0072241453,0.08323661,0.026075367,0.01611343,-0.0103782285,0.051338878,-0.030727917,-0.040546253,0.040208373,0.080649175,-0.031904463,0.07615525,0.009089179,0.05633125,-0.021038601,-0.03966976,-0.0066651027,0.054018028,0.013640984,0.024442049,-0.054037448,0.040628806,-0.014124669,0.07999169,-0.017003084,-0.020353576,0.012852781,-0.05198971,-0.103127725,0.03945313,0.02089539,-0.014682352,0.055963986,0.054021213,-0.013569402,0.0590909,-0.02481919,-0.040476628,0.07105444,0.06324305,-0.05332339,-0.011870779,-0.03031655,0.007271251,-0.00940342,-0.040496502,0.095594294,0.030333735,-5.2067254e-08,-0.115452155,0.0044696657,-0.015732767,-0.08175542,0.008422123,-0.07724399,0.053727303,0.08814281,0.056106746,0.058753517,0.08477121,-0.04451323,-0.06497598,0.00750003,0.08300372,0.03871697,0.020402733,0.046993606,-0.026950756,-0.003520146,0.07563282,0.022902492,-0.026214259,0.006264279,0.03393365,-6.822646e-05,0.04050565,0.13466044,0.08112902,0.054172475,-0.018059243,0.020467002,0.028096521,-0.036782578,0.025205383,0.08432826,0.0847332,-0.0354894,-0.06993934,0.07149539,-0.053479396,0.05803952,-0.05162031,-0.02172393,0.05797129,0.07600005,0.02437969,-0.05783753,-0.01621941,0.059532385,-0.016428985,0.023892403,-0.012764727,0.06493743,0.027884625,-0.048889156,0.009655441,0.05670605,-0.0037383446,-0.01860955,0.005973349,-0.04804946,-0.02055196,-0.014282029,2,16.976309,17.044916,11
237,"today's lecture began with variance inflation factor (vif), where we explored how vif varies with râ² and examined its graphical representation. we learned that the factor with the highest vif is the most dependent, so we remove it iteratively until all remaining factors have a vif below the threshold.

next, we covered principal component analysis (pca), another feature reduction method. key observations included:

the number of principal components equals the original data dimensions, but we select the most important ones.
principal components are orthogonal to each other.
the principal axis that captures the most variance in the data is considered the most significant.
each principal component has loadings with the original features.
we then discussed the use cases of pca, including:

prediction models â€“ pca can be used for improving model performance but is not suitable for ""what-if"" scenarios, where retaining actual features is crucial.
exploratory data analysis (eda) â€“ understanding data structure and reducing dimensions for visualization.
to illustrate pca, we applied it to a 28ã—28 pixel dataset used for predicting handwritten numbers.

finally, we introduced t-sne (t-distributed stochastic neighbor embedding) and compared normal distribution vs. t-distribution",-0.004675191,-0.06343063,0.029958092,0.015964953,0.05972911,0.029526979,-0.082593985,0.0060432577,0.019578667,-0.041398574,-0.027226213,0.0704053,-0.012174684,0.079464756,-0.06118252,-0.012085379,0.10107175,0.06556507,-0.07664099,-0.032209564,-0.012185455,-0.056314632,-0.050741266,-0.021455998,0.07060895,0.021231838,0.042036694,-0.057726376,2.5743993e-05,0.024099035,0.02540412,0.06570746,-0.024108524,-0.06603533,-0.087750725,0.04110576,0.011468492,0.07137775,-0.08457459,-0.006340859,0.009024643,0.0020947233,0.00080137677,0.05077627,0.10375286,0.011466234,-0.008278241,-0.091933794,0.016569747,0.012720263,-0.008796693,0.006708529,-0.078972645,0.032627396,-0.04384381,-0.027020521,0.026903342,-0.066708006,0.044075433,0.0015225781,0.0101753995,-0.019595757,0.0033233105,-0.0038253875,0.038195465,-0.031299315,0.04017309,-0.00705042,-0.017839415,0.014541191,-0.025764583,0.073770896,-0.031229392,0.027982539,-0.008978902,0.07348888,0.026698474,-0.012055677,0.10855221,-0.039187953,0.056106366,0.070866846,-0.013307466,-0.0217682,0.03628673,-0.008374675,0.040587675,-0.01780518,-0.050720956,0.034723602,0.03131543,0.062465545,0.033936128,-0.044291947,-0.009478714,0.0040860646,0.060297724,-0.10431988,-0.019703323,0.07909406,0.009288288,0.018304193,0.0672621,0.007824838,-0.00202787,-0.08977198,0.02688488,-0.01435722,0.020033162,-0.06391092,0.002613823,0.0022515804,-0.09497714,-0.023675898,0.11549017,-0.024091404,0.04682315,0.0364776,0.0067757796,0.0408515,-0.042831138,0.018689271,0.029602176,0.021529904,0.11630492,0.015717097,-0.07869558,7.053118e-33,0.08890519,0.037733767,0.008602962,0.0010771989,0.03298922,-0.02933901,-0.0042204475,-0.011884384,0.04364899,0.070924796,-0.052702527,0.047223184,-0.019210175,0.07329161,0.043700658,-0.008168586,-0.013439918,0.02415043,-0.017500939,-0.039623294,0.058923807,-0.07430549,0.069961905,0.004926379,-0.06475253,-0.083895385,-0.018162878,-0.066814914,-0.027496872,0.0062933313,-0.11191571,0.013609475,-0.030032806,0.027760748,-0.0507127,-0.12005953,-0.030040884,-0.09186757,0.0965762,-0.025031721,0.017081182,0.022067735,0.0034078446,-0.056290142,-0.06248339,0.023855738,0.0626279,-0.06114018,-0.027234232,0.006615179,0.053257324,0.008402421,-0.0073333117,-0.0141434865,-0.048507016,0.004808334,0.060971376,-0.048804615,0.038366918,-0.019923504,-0.074301824,0.026885668,-0.035177767,0.023858735,-0.026947692,-0.056792084,-0.0045165606,0.07391853,-0.0667043,-0.020657,-0.047872122,-0.009783716,0.004823616,-0.070881695,0.022792691,-0.021189503,0.014180261,-0.02948623,-0.042247053,0.007769763,-0.11004447,0.023887493,0.0114174355,-0.09579714,0.016965156,-0.08067219,0.03929112,-0.13361095,0.011880922,-0.10213951,-0.039114423,0.025947466,0.08192091,-0.025957732,0.019454941,-5.5776263e-33,-0.09877546,0.054672748,0.009089481,0.08458105,0.0391228,-0.049292024,-0.029649487,0.012104619,-0.02670982,-0.11778116,0.036807455,-0.03738881,0.038450096,-0.00096038554,0.06441158,0.05333739,0.0003713892,0.00075888,-0.055096906,-0.06153605,-0.064203605,-0.04444976,-0.026302168,0.036089014,-0.040384352,-0.017661005,0.01950812,-0.07714516,-0.029312255,-0.06924836,-0.042530756,0.060783453,-0.029401293,0.052160818,-0.032536775,-0.0036550548,0.0039720666,-0.07920497,0.003172786,0.09680093,0.13588502,0.046413668,0.010935752,0.05173393,-0.05304517,-0.023451475,-0.013225235,0.07211071,0.079019286,0.023562437,0.026398556,0.058199603,0.0042527816,0.015235771,0.032461286,-0.014040125,0.082285024,-0.034037855,0.10399663,0.036734696,0.014168747,-0.059515852,-0.01503743,-0.02588123,-0.024077177,-0.051453866,0.02690724,0.041326612,-0.032530744,0.00649593,-0.0050316933,-0.007623193,-0.046309676,-0.017557714,-0.010803388,-0.049218908,0.05944077,0.013161022,0.026046121,-0.004406023,0.044620417,-0.010369424,0.03141318,-0.073436506,0.031313818,0.1470837,0.020466764,-0.014736695,0.038068365,0.0055972673,-0.06479989,0.05497012,-0.052256085,0.10421985,0.07752835,-5.5127828e-08,-0.07018085,0.017143197,0.010628602,-0.04752033,0.02471375,-0.069995865,0.051012244,0.15005709,0.02389667,0.019414742,0.1359,-0.06282149,-0.10349103,-0.011476133,0.061622266,0.11013875,0.045263994,-0.0040062526,-0.024100458,-0.009428512,0.042331293,-0.0067277616,0.0060396725,-0.0156133,0.0463556,-0.055401,0.014007451,0.18021335,0.07899349,-0.0077613266,-0.0004976014,-0.002940729,0.00900375,-0.069212474,-0.005926914,0.024118178,0.12896964,-0.021823958,-0.018961977,0.041996904,-0.000117531294,0.06152242,-0.03561801,-0.0070635653,0.005232541,0.067329116,0.01938099,-0.046179462,0.018143667,0.00473095,-0.07712804,-0.042205144,0.017330948,0.07770703,0.0633454,0.037112124,-0.022770192,0.032667406,0.028431503,-0.047296505,-0.022244025,-0.046244,-0.07743462,0.008029037,2,15.809214,15.9443865,11
239,"learned about pca, which helps reduce data size while keeping important patterns.
before using pca, it's necessary to remove similar information using vif.
principal components (pcs) were introduced, which hold the most important variations in the data.
pca helps in simplifying data by keeping only the essential parts.
the elbow method was explained as a way to decide how many pcs to keep.
discussed where pca is useful, such as in data visualization, making predictions, and understanding data patterns.
compared normal regression with pca-based regression, showing how pca makes models easier to understand and more effective.
ended with how pca is applied in real-world data projects and its role in predictive analysis.",0.046534505,0.036147732,0.0010064772,-0.010272063,0.0498111,-0.0044344184,-0.02707038,0.039823897,0.040015288,0.07011681,0.018551014,0.09413468,-0.07261701,0.030079443,-0.048008934,-0.017669177,0.0015613236,-0.014686269,-0.058513388,-0.052383058,-0.008318784,0.015603472,-0.012369184,0.01949045,-0.051791906,0.107779585,0.043995097,0.015047747,0.017876638,0.009899587,0.035092887,0.09996966,0.057127938,-0.003261384,-0.095492266,0.0046109906,-0.029833622,0.087917104,-0.08271116,0.0030401796,-0.003982566,0.006735609,-0.039315622,0.06190076,0.11569959,0.040624402,-0.07003549,-0.087259986,0.06581205,-0.03309796,-0.051288713,-0.03905152,-0.013328393,-0.015286346,-0.017800517,-0.02913524,0.0014024794,-0.04547785,0.038357142,0.016155738,0.011596801,-0.0035804934,0.01151105,-0.016354825,0.08633305,-0.04788913,0.016554652,0.02401596,-0.022202944,-0.019984635,-0.064748265,0.02868961,-0.07437911,0.043122265,-0.012300531,0.08611297,-0.046429865,0.0012007589,0.053973593,0.0031502058,-0.007141665,0.093812995,-0.02295185,0.050100323,0.03610198,0.06656461,0.019466443,-0.058216613,-0.066329196,-0.036008604,0.07739726,0.053032786,0.084618144,-0.040183224,0.0026675551,0.017997904,0.012291929,-0.121403344,-0.0049258084,-0.0014924944,-0.03027932,-0.039625008,0.049633887,0.024710134,-0.07026484,-0.097145386,-0.007886841,0.031172916,0.04566458,-0.010383434,-0.06889079,0.023065671,-0.097778596,-0.035229366,0.0793646,-0.02972094,-0.07096525,0.07115977,0.00244362,0.04734923,0.008024727,-0.032727666,0.059436698,0.00669203,0.06421137,0.034438852,-0.08712405,5.346261e-33,0.0022982552,0.0073188543,-0.040195517,0.03228806,0.0007037935,-0.03758094,0.0022002116,-0.042876467,0.09147584,0.09102587,0.0036005122,0.05467136,0.019020949,0.06837925,0.058407966,0.028367314,-0.005564017,0.09200982,-0.08356166,-0.032403585,0.05117185,-0.068136066,0.15512969,-0.04130362,-0.004103055,-0.019688262,-0.050440963,-0.016975926,0.00849194,-0.036794916,-0.011208079,0.047068443,-0.05038508,0.0066925953,-0.024341466,-0.0323028,0.0027162165,-0.14606461,0.06760831,0.033041168,-0.01533162,0.055432808,0.044393893,-0.07009993,0.02860473,0.06695487,0.011400636,-0.0010321358,-0.048825104,0.020638812,0.03283137,0.016511505,0.010462962,-0.017008392,-0.0648934,0.073291965,0.046458714,-0.11917556,0.002638622,-0.028968008,-0.07339582,0.001159593,0.020975044,-0.008851517,-0.049900834,-0.038720526,0.0005533715,0.07274829,0.01960216,0.0062064426,-0.0052772365,-0.03811196,-0.011101877,-0.0038601551,0.00023618055,-0.05543066,-0.09275778,0.04023635,0.002855268,0.023519047,-0.050161056,0.08589714,0.02227374,-0.08272321,0.08846526,-0.06386092,0.05242134,-0.08437306,-0.04835997,-0.052086722,-0.07799708,0.057703782,0.007084844,0.015446801,0.00623261,-5.468457e-33,-0.070436694,0.06716169,-0.02418854,0.02023588,0.014113751,-0.039692603,-0.010734881,-0.07343626,0.045445103,-0.014783915,0.051673733,-0.04173704,0.027637973,-0.008254796,0.024692874,0.041128747,0.0072831027,-0.047751028,-0.021758806,-0.06782921,-0.035587817,-0.078575775,0.007720067,-0.06773076,0.0019169811,-0.081565805,-0.052397303,-0.066595234,-0.04958953,-0.070297234,-0.035753008,-0.0016110584,-0.012825461,0.028551146,0.009515116,-0.024584677,-0.072916605,-0.06601491,0.07113956,0.09121908,0.061739624,0.042967685,-3.673746e-05,-0.025008108,-0.08022059,-0.0698273,0.017491605,0.07953941,0.014335236,-0.012767174,0.059431568,0.05508042,0.04018699,-0.054507427,0.03961031,0.022101283,0.08815231,-0.00037419685,0.008997269,-0.017409688,0.048791703,0.0028663585,0.016845614,0.06720172,-0.028155375,-0.0025355234,0.03370499,-0.065872625,-0.064500764,-0.087549984,0.0068389964,0.048717577,0.043851174,0.05349645,-0.05279581,-0.09531942,-0.033739906,-0.01577521,0.058692217,0.028874638,-0.046694554,-0.07616401,0.0066983243,-0.0018997701,-0.006707336,0.077931195,0.04287241,-0.051919118,0.002130521,0.009040045,-0.10974487,-0.011111501,0.017303279,0.09619996,0.03053404,-4.9061313e-08,-0.0698526,-0.05263837,0.0141412625,-0.056257054,0.048338003,-0.05872392,-0.035454713,0.16212472,-0.0019473739,0.05068207,0.09880186,-0.018831847,-0.1095001,0.06406168,0.0850794,0.052482713,0.08664077,0.04608884,-0.03721901,-0.028584598,0.043582074,-0.02010254,-0.034086872,-0.01683679,0.106178276,-0.077387154,0.007629791,0.14020306,-0.023182947,-0.020351663,0.06978909,-0.02573511,0.043507516,-0.008823779,0.036680095,0.044763587,0.09527245,0.040852237,-0.009505005,0.026245775,-0.094683684,0.014846567,-0.026374854,0.0069974335,0.047218207,0.053477068,-0.0125282295,-0.03550804,-0.02794308,-0.033891514,0.00038012164,-0.03603844,0.046862356,0.029791782,0.044725418,0.053984497,0.049583208,0.04932884,-0.017199364,-0.013886834,-0.05759153,0.020465316,-0.018754132,0.010617057,2,19.207893,18.146143,11
256,"in todayâ€™s lecture we saw some more methods to reduce the dimensionality of data, inorder to solve data problems associated with large dimensions. 
in the last class, we had talked about vif analysis. we continued the discussion on it. 
in vif analysis, we start eliminating the features one by one, with the ones having large vif values. we continue the process until we get a set of features which have vif values, smaller than the desired threshold, which can be 10/5. we eliminate the features based on our domain knowledge.
depending on the threshold set, we can have different combination and numbers of features selected for the regression model. in such a case, we should evaluate the metrics for each of the model and then by comparing these, we can decide which one to use.
the next method we saw was that of pca (principal component analysis). it helps to reduce the dimensionality of the problem by creating orthogonal principal components. each of the principal component is a combination of the original features, with the weights called as â€˜loadingsâ€™. the loadings tell us the importance of each feature. so, instead of using too many features, we are combining them into a principal component and using this to predict the response variable. the number of principal components is equal to that of the original dimensions. however, we can decide to take up two/three of these pcs suitable to our model. the first pc explains the maximum variance in the data, the next explains some amount of the remaining variance. this continues until all the principal components explain the complete variance in the data.
the cumulative variance explained by all the pcs is given by the elbow diagram, which is asymptotic to 1. the elbow diagram tells us how many pcs would be needed to explain a certain amount of variance in the data.
among the two methods, vif is generally preferred first because of interpretability. x1,x2,x3 etc.  represent the actual physical features, whereas the pcs, which are a combination of these are just mathematical parameters. 
so, pcs are most suitable for prediction analysis but they cannot be used for â€˜what-if analysisâ€™ or â€˜delta analysisâ€™. hence, through pcs we achieve the goal of reducing the dimensions, however we cannot do any sensitivity analysis.
so, normally vif is done first and if still there are many features left, we perform pca.
the advantages of using pca is that it helps in dimension reduction (data reduction), predictive analysis, visualization (understanding of the structure of the data). so, this is a part of eda and can be used to determine the number of clusters (k) in k-means clustering.
another disadvantage of pca is that it is sensitive to data scale. hence, normalization (if required) must be done before doing pca.
next, we talked about the t-sne plots. 
the t-sne plots also reduce the large number of dimensions in the data into 2-3 dimensions which can be easily visualized. this is done on the basis of the distance between the points in the n-dimensional space. through this method, we lose the exactness of the data, but instead we get the information about the relative closeness of the points. 
t-sne creates a probability distribution for each of the point, which contains the probability of closeness of that point from every other point. 
gaussian normal distribution is used in higher dimensional space, but in t-sne, as the name suggests, t-distribution is used. t-distribution increases the distance between dissimilar points. so, in n-dimensional space, if the probability of two points being close is very high, they are clustered together in the t-sne plots.
all these methods help in reducing the number of dimensions in the data set.
",0.00231145,0.02954308,0.045074087,-0.03417548,0.01733632,0.033782717,-0.011059958,0.05857695,0.05548901,0.018044768,-0.02070862,0.011151557,-0.09923559,0.06945852,-0.02136147,-0.012850482,0.10338364,0.05820376,-0.12297417,0.002695597,0.025844768,-0.037979055,-0.04041854,0.06142785,-0.05180965,0.020352088,-0.0052873935,-0.008109943,0.0043549794,0.021372987,0.044531204,0.109754615,-0.026597429,-0.021478012,-0.07343609,0.076828085,-0.03831137,-0.008032774,-0.0952651,-0.023035312,-0.022335267,0.021730058,0.003041933,0.061438095,0.06099968,-0.013174152,-0.031298395,-0.07020665,0.04226332,-0.09116778,-0.0148804495,0.06352659,-0.07108177,-0.0029182835,-0.04016104,-0.09530816,0.009518204,-0.084698275,-0.01639181,-0.009954742,-0.029244531,-0.010704198,0.0204143,-0.019730188,0.075207815,0.015739357,0.0014859512,-0.040058266,-0.07259563,0.08605366,-0.052945938,0.022412453,-0.04688024,0.014561446,-0.013661824,0.04704382,-0.009109204,0.02898447,0.06917109,-0.014260594,0.061694928,0.097281955,0.03365139,-0.038616307,-0.005891362,-0.004739419,0.04229738,-0.13177755,-0.011148075,0.008314621,0.09222133,0.023089256,0.05545508,0.0025443826,0.036461893,-0.016685557,0.013138845,-0.11327682,0.032936577,0.040179912,-0.048957977,-0.023999175,0.088306025,0.023188453,0.0071364604,-0.021635722,-0.030974893,0.07046494,0.0075932653,-0.054517277,0.007868208,0.044715423,-0.034712188,-0.0027336834,0.07716543,0.008468974,0.026461072,0.04664616,0.026376745,0.046053044,-0.010486097,-0.082450114,0.019181965,-0.0049452996,0.0610851,0.052081566,-0.08079014,3.611684e-33,0.0035714249,0.029178092,-0.014003793,-0.024326688,-0.038016878,0.045465946,0.049827855,-0.010976419,0.048566494,0.03813607,-0.052031416,-0.03165574,0.033973455,0.05445172,0.097873226,0.009696595,0.022908386,0.038817134,-0.01154119,-0.061595377,0.10616294,-0.09513381,0.107894614,0.022105608,-0.0543754,-0.1302599,-0.06236436,-0.007124206,-0.1479285,-0.029724393,-0.053438403,0.03700088,-0.03527451,0.07244272,0.0054083397,-0.050302934,0.02014832,-0.065480515,0.07309603,-0.03607534,0.013345943,0.016867308,-0.012725401,-0.011568604,-0.0227077,0.06926322,0.036785793,-0.013620483,-0.09809546,0.022110414,0.05189505,0.02753216,-0.030925361,-0.04787455,-0.077467,0.025262414,0.009651266,-0.10994218,-0.015589708,0.0045965193,-0.060915902,-0.05188746,0.03781557,-0.04513157,0.04804997,-0.105810255,0.021701295,-0.016761966,0.0043501896,0.0038594734,-0.054426234,0.0098622395,0.023231855,-0.11473061,0.058056973,-0.060562946,0.049884632,-0.030209625,0.015140747,-0.025164,-0.068853386,0.1182772,0.03852448,-0.101038896,0.0768948,-0.07567606,0.05677826,-0.08065756,-0.041092683,-0.07482719,-0.0805718,0.038973607,0.056332108,-0.02965505,0.015459816,-3.5676966e-33,-0.011731709,0.019236382,0.0026659435,0.012539502,0.013545248,-0.035477825,-0.018437453,-0.0071652983,-0.075433925,-0.10751571,0.04714323,-0.044093512,0.034422107,-0.028085176,0.005311165,0.08807898,-0.006846262,-0.071178876,0.005597497,0.04338564,-0.02803182,-0.0073198476,-0.0014514221,0.022613062,-0.0566656,-0.061105892,-0.029560257,-0.035997055,-0.020704724,0.0027139005,0.01818691,0.06879394,-0.050953247,0.051268697,0.014755773,0.007206528,0.035894547,-0.0279055,0.023937065,0.12125699,0.04311769,0.008507346,-0.09722827,-0.0034702097,-0.05959943,-0.04420439,0.031180171,0.06489613,-0.024648037,-0.034531094,0.06444464,0.017056394,0.0400097,0.07858809,-0.0046980223,0.032821793,0.061125245,-0.057760134,0.06312052,-0.0014393276,0.04538896,-0.007188742,-0.0021542967,0.019602131,0.031235805,0.016275354,0.075236514,0.03483792,-0.018245885,-0.020082781,-0.063999705,-0.059452742,0.093739934,-0.004055114,-0.023611948,-0.08406598,0.007829172,-0.0638973,0.018101975,0.049990784,-0.012085911,-0.00875393,0.009463413,-0.02173893,-0.026262052,0.09025589,0.043543868,0.025210567,0.023180103,0.011712381,-0.023511766,-0.013399334,0.015357681,0.059530735,0.08065487,-5.9900216e-08,-0.026106942,-0.036285765,-0.03159499,-0.09763376,0.005945414,-0.079041585,-0.039546702,0.16340914,-0.006035193,0.067790374,0.106383294,0.011141106,-0.09678677,0.09834432,0.07279525,0.011704364,-0.0093687875,0.06501598,-0.060044985,0.04399059,0.041832406,-0.01283593,-0.01767659,-0.06227778,0.1088122,-0.08403067,0.03777458,0.035792697,0.02452954,0.050475635,0.02741879,0.010910422,-0.027900541,0.0016493297,0.033142786,0.06363616,0.07654963,-0.03810455,-0.039133415,0.04053014,-0.015217898,-0.008844885,-0.004560668,0.008647293,0.05067484,0.022428494,-0.0045823003,0.023075474,0.06323672,0.036210366,-0.03809233,0.018944113,-0.047305062,0.11216219,0.01331411,-0.001013106,-0.0077057052,0.07417267,0.009862667,-0.0519812,-0.0068514524,-0.05036288,-0.0078084255,-0.044130467,2,17.821007,13.366616,11
