SerialNo,Session_Summary,BERT_Feature_0,BERT_Feature_1,BERT_Feature_2,BERT_Feature_3,BERT_Feature_4,BERT_Feature_5,BERT_Feature_6,BERT_Feature_7,BERT_Feature_8,BERT_Feature_9,BERT_Feature_10,BERT_Feature_11,BERT_Feature_12,BERT_Feature_13,BERT_Feature_14,BERT_Feature_15,BERT_Feature_16,BERT_Feature_17,BERT_Feature_18,BERT_Feature_19,BERT_Feature_20,BERT_Feature_21,BERT_Feature_22,BERT_Feature_23,BERT_Feature_24,BERT_Feature_25,BERT_Feature_26,BERT_Feature_27,BERT_Feature_28,BERT_Feature_29,BERT_Feature_30,BERT_Feature_31,BERT_Feature_32,BERT_Feature_33,BERT_Feature_34,BERT_Feature_35,BERT_Feature_36,BERT_Feature_37,BERT_Feature_38,BERT_Feature_39,BERT_Feature_40,BERT_Feature_41,BERT_Feature_42,BERT_Feature_43,BERT_Feature_44,BERT_Feature_45,BERT_Feature_46,BERT_Feature_47,BERT_Feature_48,BERT_Feature_49,BERT_Feature_50,BERT_Feature_51,BERT_Feature_52,BERT_Feature_53,BERT_Feature_54,BERT_Feature_55,BERT_Feature_56,BERT_Feature_57,BERT_Feature_58,BERT_Feature_59,BERT_Feature_60,BERT_Feature_61,BERT_Feature_62,BERT_Feature_63,BERT_Feature_64,BERT_Feature_65,BERT_Feature_66,BERT_Feature_67,BERT_Feature_68,BERT_Feature_69,BERT_Feature_70,BERT_Feature_71,BERT_Feature_72,BERT_Feature_73,BERT_Feature_74,BERT_Feature_75,BERT_Feature_76,BERT_Feature_77,BERT_Feature_78,BERT_Feature_79,BERT_Feature_80,BERT_Feature_81,BERT_Feature_82,BERT_Feature_83,BERT_Feature_84,BERT_Feature_85,BERT_Feature_86,BERT_Feature_87,BERT_Feature_88,BERT_Feature_89,BERT_Feature_90,BERT_Feature_91,BERT_Feature_92,BERT_Feature_93,BERT_Feature_94,BERT_Feature_95,BERT_Feature_96,BERT_Feature_97,BERT_Feature_98,BERT_Feature_99,BERT_Feature_100,BERT_Feature_101,BERT_Feature_102,BERT_Feature_103,BERT_Feature_104,BERT_Feature_105,BERT_Feature_106,BERT_Feature_107,BERT_Feature_108,BERT_Feature_109,BERT_Feature_110,BERT_Feature_111,BERT_Feature_112,BERT_Feature_113,BERT_Feature_114,BERT_Feature_115,BERT_Feature_116,BERT_Feature_117,BERT_Feature_118,BERT_Feature_119,BERT_Feature_120,BERT_Feature_121,BERT_Feature_122,BERT_Feature_123,BERT_Feature_124,BERT_Feature_125,BERT_Feature_126,BERT_Feature_127,BERT_Feature_128,BERT_Feature_129,BERT_Feature_130,BERT_Feature_131,BERT_Feature_132,BERT_Feature_133,BERT_Feature_134,BERT_Feature_135,BERT_Feature_136,BERT_Feature_137,BERT_Feature_138,BERT_Feature_139,BERT_Feature_140,BERT_Feature_141,BERT_Feature_142,BERT_Feature_143,BERT_Feature_144,BERT_Feature_145,BERT_Feature_146,BERT_Feature_147,BERT_Feature_148,BERT_Feature_149,BERT_Feature_150,BERT_Feature_151,BERT_Feature_152,BERT_Feature_153,BERT_Feature_154,BERT_Feature_155,BERT_Feature_156,BERT_Feature_157,BERT_Feature_158,BERT_Feature_159,BERT_Feature_160,BERT_Feature_161,BERT_Feature_162,BERT_Feature_163,BERT_Feature_164,BERT_Feature_165,BERT_Feature_166,BERT_Feature_167,BERT_Feature_168,BERT_Feature_169,BERT_Feature_170,BERT_Feature_171,BERT_Feature_172,BERT_Feature_173,BERT_Feature_174,BERT_Feature_175,BERT_Feature_176,BERT_Feature_177,BERT_Feature_178,BERT_Feature_179,BERT_Feature_180,BERT_Feature_181,BERT_Feature_182,BERT_Feature_183,BERT_Feature_184,BERT_Feature_185,BERT_Feature_186,BERT_Feature_187,BERT_Feature_188,BERT_Feature_189,BERT_Feature_190,BERT_Feature_191,BERT_Feature_192,BERT_Feature_193,BERT_Feature_194,BERT_Feature_195,BERT_Feature_196,BERT_Feature_197,BERT_Feature_198,BERT_Feature_199,BERT_Feature_200,BERT_Feature_201,BERT_Feature_202,BERT_Feature_203,BERT_Feature_204,BERT_Feature_205,BERT_Feature_206,BERT_Feature_207,BERT_Feature_208,BERT_Feature_209,BERT_Feature_210,BERT_Feature_211,BERT_Feature_212,BERT_Feature_213,BERT_Feature_214,BERT_Feature_215,BERT_Feature_216,BERT_Feature_217,BERT_Feature_218,BERT_Feature_219,BERT_Feature_220,BERT_Feature_221,BERT_Feature_222,BERT_Feature_223,BERT_Feature_224,BERT_Feature_225,BERT_Feature_226,BERT_Feature_227,BERT_Feature_228,BERT_Feature_229,BERT_Feature_230,BERT_Feature_231,BERT_Feature_232,BERT_Feature_233,BERT_Feature_234,BERT_Feature_235,BERT_Feature_236,BERT_Feature_237,BERT_Feature_238,BERT_Feature_239,BERT_Feature_240,BERT_Feature_241,BERT_Feature_242,BERT_Feature_243,BERT_Feature_244,BERT_Feature_245,BERT_Feature_246,BERT_Feature_247,BERT_Feature_248,BERT_Feature_249,BERT_Feature_250,BERT_Feature_251,BERT_Feature_252,BERT_Feature_253,BERT_Feature_254,BERT_Feature_255,BERT_Feature_256,BERT_Feature_257,BERT_Feature_258,BERT_Feature_259,BERT_Feature_260,BERT_Feature_261,BERT_Feature_262,BERT_Feature_263,BERT_Feature_264,BERT_Feature_265,BERT_Feature_266,BERT_Feature_267,BERT_Feature_268,BERT_Feature_269,BERT_Feature_270,BERT_Feature_271,BERT_Feature_272,BERT_Feature_273,BERT_Feature_274,BERT_Feature_275,BERT_Feature_276,BERT_Feature_277,BERT_Feature_278,BERT_Feature_279,BERT_Feature_280,BERT_Feature_281,BERT_Feature_282,BERT_Feature_283,BERT_Feature_284,BERT_Feature_285,BERT_Feature_286,BERT_Feature_287,BERT_Feature_288,BERT_Feature_289,BERT_Feature_290,BERT_Feature_291,BERT_Feature_292,BERT_Feature_293,BERT_Feature_294,BERT_Feature_295,BERT_Feature_296,BERT_Feature_297,BERT_Feature_298,BERT_Feature_299,BERT_Feature_300,BERT_Feature_301,BERT_Feature_302,BERT_Feature_303,BERT_Feature_304,BERT_Feature_305,BERT_Feature_306,BERT_Feature_307,BERT_Feature_308,BERT_Feature_309,BERT_Feature_310,BERT_Feature_311,BERT_Feature_312,BERT_Feature_313,BERT_Feature_314,BERT_Feature_315,BERT_Feature_316,BERT_Feature_317,BERT_Feature_318,BERT_Feature_319,BERT_Feature_320,BERT_Feature_321,BERT_Feature_322,BERT_Feature_323,BERT_Feature_324,BERT_Feature_325,BERT_Feature_326,BERT_Feature_327,BERT_Feature_328,BERT_Feature_329,BERT_Feature_330,BERT_Feature_331,BERT_Feature_332,BERT_Feature_333,BERT_Feature_334,BERT_Feature_335,BERT_Feature_336,BERT_Feature_337,BERT_Feature_338,BERT_Feature_339,BERT_Feature_340,BERT_Feature_341,BERT_Feature_342,BERT_Feature_343,BERT_Feature_344,BERT_Feature_345,BERT_Feature_346,BERT_Feature_347,BERT_Feature_348,BERT_Feature_349,BERT_Feature_350,BERT_Feature_351,BERT_Feature_352,BERT_Feature_353,BERT_Feature_354,BERT_Feature_355,BERT_Feature_356,BERT_Feature_357,BERT_Feature_358,BERT_Feature_359,BERT_Feature_360,BERT_Feature_361,BERT_Feature_362,BERT_Feature_363,BERT_Feature_364,BERT_Feature_365,BERT_Feature_366,BERT_Feature_367,BERT_Feature_368,BERT_Feature_369,BERT_Feature_370,BERT_Feature_371,BERT_Feature_372,BERT_Feature_373,BERT_Feature_374,BERT_Feature_375,BERT_Feature_376,BERT_Feature_377,BERT_Feature_378,BERT_Feature_379,BERT_Feature_380,BERT_Feature_381,BERT_Feature_382,BERT_Feature_383,kmeans_cluster,TSNE_1,TSNE_2,agglo_cluster
12,"in today's session, we first analyzed the summaries we write after every class using the pivot table in excel, in which we see the number of people who submitted the summary, the average word length of summaries, the minimum number of characters in any summary and the maximum number of character in any summary. we plot the data collected through summaries into a histogram, which tells about the shape of the data, and then the box plot to further analyze the data. we find the descriptive statistics of the data and scatter plots of data points. we also see how many times a person has submitted the summary, and then we plot the changes in the summary over time, including changes in maximum words and minimum words in the summaries. then, we also analyzed other data with different columns of data, and at last, we plotted the data, including the outliers. at the end of the class, we got the assessment of exercise 2 by the teaching assistant, including some points which are as follows: proper naming of files; proper plots with titles, labeling, and legend; excel file submission as (.xlsx) form and not (.csv) as they don't contain the formulas we have used for performing the data analysis; formatting the document in a proper format; providing examples if asked; using a spreadsheet if mentioned, making all the necessary plots and calculating correct descriptive statistics; adding residual diagnostics, talking about all the metrics obtained and not just r^2; creating a dataset with large variance; rmse, f-statistic, r^2 vs std. dev. plots; mentioning the ci interval also with the description about it.",0.031702444,0.04804754,-0.02748983,-0.033460762,-0.057592064,0.041307606,-0.030678568,0.08282366,0.06354237,0.04435285,0.020136047,0.03236867,0.078106,0.006985753,-0.051713087,-0.012990391,0.0357201,-0.03190193,-0.05192532,-0.03164443,0.041438818,0.010931542,0.0106789265,0.015100369,0.09278126,0.06439705,-0.01464498,0.009772486,-0.07993291,-0.058200937,-0.045954008,0.00952747,0.090710916,0.07147397,-0.07132361,-0.061447192,-0.0138044385,0.084393375,0.069902405,-0.015200232,-0.091348924,-0.018632963,0.07574846,0.026707225,0.051634867,-0.0091795605,-0.069166176,-0.096393585,-0.0084715905,0.020516114,-0.084825225,0.06642803,0.022907078,-0.005586866,0.008924476,-0.029395292,0.0028309047,-0.09993916,0.051478803,-0.044535644,-0.04370753,-0.0051910696,-0.0015405538,0.023139345,0.012870237,-0.025236279,-0.005177274,0.043244246,0.016878713,0.09684825,-0.053902976,0.064506166,-0.04069321,0.004260398,-0.041520976,0.027083617,-0.13114214,-0.02972175,-0.008764954,-0.10049825,0.009161851,0.024574494,0.028614689,0.045353994,0.035406247,-0.023727693,0.10018771,0.07427225,-0.02261729,-0.013936667,-0.022312315,-0.016846182,0.01232726,0.061843142,-0.034143433,0.043908454,-0.025878446,0.01184996,0.09195128,0.038531415,0.02499111,0.03241763,-0.024359439,-0.09126687,-0.052822825,-0.05990532,0.0509512,-0.03701288,-0.012812654,-0.07813767,0.015876763,-0.067085035,-0.12128851,0.00072996,0.035209477,0.020055236,0.031645607,-0.00718738,-0.09785794,0.01834211,0.041865613,0.007302952,0.0189753,0.04899465,-0.014811052,-0.016594736,-0.01658525,2.7227803e-33,-0.007545352,-0.007944821,-0.053227086,0.10062923,0.00876196,-0.027829345,-0.04455743,-0.021912958,0.07921258,0.010144548,-0.0028608174,0.101495065,0.07171442,0.016474737,0.022208977,0.032186855,-0.012637312,0.0484432,-0.097056665,0.024598954,0.01624841,-0.09834604,0.1037733,-0.011201377,0.013847537,0.04023772,0.03644533,-0.04387776,-0.02348419,-0.012866142,0.033652022,-0.03124722,-0.012888278,-0.055145808,0.0753317,-0.07009924,0.045710657,0.0029252388,0.052796137,0.031161511,-0.027579414,-0.020155119,0.03173374,-0.047507934,-0.0010735276,0.06559696,0.0105654,0.0340877,-0.005709153,0.010997695,-0.054472804,-0.058146376,0.10342622,0.022322632,0.0086359065,0.06385764,-0.009822333,-0.017935133,-0.038070366,0.02812202,0.065307595,0.029842528,-0.034100387,0.016785918,-0.03477662,0.0037384536,-0.080899775,0.073126726,0.07057803,0.0019553518,-0.0027049535,0.00057660596,-0.006255742,0.026882222,0.07242634,0.014163653,0.032536596,0.03247158,-0.10835026,-0.0588765,0.026921988,-0.10702335,-0.009168898,-0.14063527,-0.10302269,-0.030716656,0.0829391,-0.020901265,-0.014413632,-0.033613984,-0.070730545,0.0103161065,-0.08353246,0.07462528,0.02406787,-4.5112222e-33,-0.059490558,0.10407009,-0.066941775,0.0032508473,0.09463773,0.06626944,0.05547477,0.027650869,0.038178723,-0.017346315,-0.09272213,-0.099359155,0.016425991,-0.0061320933,0.023061711,-0.02465273,-0.0042407657,-0.0075807525,-0.070248745,-0.029394414,-0.021533212,0.0674973,-0.020982213,-0.01940985,0.04672948,0.086181976,-0.057653353,-0.080106415,-0.09874612,-0.0016011661,-0.016953282,-0.013928976,-0.0304664,0.0065202382,-0.09818088,-0.032668334,0.040500883,-0.08875905,-0.023626544,0.0689197,0.026699273,0.0127168065,0.008683643,-0.047794413,0.04225014,0.035718314,-0.030455163,-0.0074759526,0.00714575,0.019945776,0.0008123313,0.064984374,0.0055249697,0.0427554,0.04237117,-0.031119736,0.023115678,-0.103335656,-0.076894194,-0.014627202,-0.030745098,-0.020295322,-0.010441309,0.03139342,0.045655083,-0.025603725,-0.010889415,-0.10686257,-0.06319994,0.1055224,0.019402403,-0.019674862,-0.036831513,-0.064288855,0.08562354,0.08196374,-0.08413412,-0.020697737,-0.072036736,0.0059741833,-0.007553293,-0.08827839,0.07262083,0.0074858135,-0.042521935,0.0400541,-0.0069544693,-0.024326222,-0.011231747,0.049924567,-0.07283379,-0.010883961,-0.0056094243,-0.029714508,0.0008159237,-5.5996427e-08,-0.04825734,-0.058262423,-0.026657207,0.0072646877,0.073420845,0.011683032,-0.08347765,0.075830586,0.003017672,0.024196502,0.0955151,-0.0622948,-0.025910899,-0.021409279,0.024360005,0.037872966,0.07809976,0.042894904,-0.0374146,-0.044177067,0.011297492,0.0060275374,-0.10271742,0.01184674,-0.014073443,-0.0044494653,-0.014001757,0.09557068,-0.050181925,-0.015707219,0.048750624,-0.006722329,0.007368047,-0.04332435,-0.044853836,0.016511107,0.025703503,0.028937263,0.02472748,0.15964854,-0.06588142,0.035929658,0.0078182835,0.02900711,0.115919106,5.648429e-05,-0.10889417,-0.009908004,0.032439906,-0.055839248,0.0041413354,-0.07563617,-0.012958501,0.0065667867,-0.0050753406,0.07156883,0.015295596,0.05824482,-0.01670575,-0.03406982,0.038565032,0.075629294,-0.062678896,-0.007901183,6,-5.16611,25.81374,8
17,"in todays class , we first discussed about exploratory data analysis. we explored pivot table tool in excel . in which we worked first with the class data of summaries which we submit. we learnt how to arrange data according to different parameters, how to arrange them in rows and columns .then we worked eda on chemical lab data in excel sheet. we first arranged data according to time , ie , years then months then dates. and then assessed them like by finding the mean , minimum value , maximum value and so on. we them came across a 0 minimum value of a particular year , on exploring more , there were 3 days with no sensor reading , hence 0 . we then checked mean , median , mode and so on using data analysis tool and from that value, we concluded that, in assymetric distribution, mean is not around in the middle of min and max values . also its histogram will be on the one side. we can also check kurtosos and skewness to prove it. 
then we check outliers and anomalies. 
we used correlations for different features to bring out relationships in a heat map. 
in histograms , we can see outliers and can remove them to perform eda on the rest of the data.
then the tas  gave review about the e2 assignment",0.0019946021,0.02570874,-0.031179605,-0.012405943,-0.09032223,-0.004893491,-0.09926044,0.053089418,0.018870592,0.04184461,0.053679954,-0.020630816,0.08540547,-0.006854912,-0.045183286,-0.03253668,0.011606235,-0.03676068,-0.048760526,-0.068136245,-0.0013262307,-0.059844416,-0.080629155,-0.03224214,0.012617643,0.036104903,0.0037535788,-0.056653105,-0.05143439,-0.027885687,-0.017206224,0.055060558,0.030057592,0.019678807,-0.015542027,-0.05715051,0.03175556,0.059620835,0.0051182215,0.012702421,-0.03507883,-0.039969508,0.057804044,0.0018739105,-0.018207384,0.013143388,-0.026123717,-0.10962405,-0.024294334,0.017693713,-0.10002451,0.075650744,-0.017027501,-0.0016416238,0.054742668,-0.059028782,-0.051457312,-0.10110017,0.062624335,-0.049102943,0.0018429947,-0.013903457,0.013252871,0.0032823677,0.06660916,-0.0032923478,0.027561314,-0.0024672917,0.029221948,0.048728414,-0.015385119,0.025968552,-0.10101993,0.006216645,0.001671702,-0.0047426866,-0.052853823,-0.01803504,0.015041109,-0.09258196,0.031077888,0.0783743,-0.018401552,0.0746267,-0.000124772,-0.017215895,0.040565666,0.091188505,-0.0434234,0.055337057,0.05047596,0.0758078,-0.061636787,0.008085209,0.01753329,0.042360753,0.0046358537,-0.008379158,0.12550639,0.035623148,-0.021052308,-0.013818123,-0.046268582,-0.037601713,-0.015688809,-0.08910142,0.018024255,-0.046329718,-0.043728683,0.004241871,-0.034148373,-0.05920665,-0.077142075,-0.07414781,0.0124357985,-0.04510394,-0.022495484,-0.011628611,-0.0658308,0.009018639,-0.00807165,0.04995265,0.026273418,0.084784254,0.044885065,0.03863137,-0.048661552,6.051822e-33,-0.01767034,-0.06044019,0.003610384,-0.025616433,-0.04162012,-0.005424604,-0.030009534,-0.03605034,0.06494537,0.03644355,0.016228806,0.13923773,0.017728832,-0.020391902,0.04497004,0.017892733,0.023909364,0.03385814,-0.07425401,-0.064832285,-0.044510245,-0.13415888,0.104970045,-0.0014758615,0.035106782,0.082390614,0.011230828,0.020227207,-0.03024924,-0.009072004,0.060891498,0.019785674,-0.074266255,-0.042915132,0.00422987,-0.017479302,0.03269373,0.013181405,0.020943934,0.017208237,-0.03338178,0.028809793,0.020435749,-0.008157393,0.009627931,0.10056988,0.08192135,0.03438435,0.04908339,0.015930304,-0.08417702,-0.064050466,0.074698076,-0.019830484,-0.06684361,0.10683893,-0.022312567,-0.08638127,-0.046907537,0.04170879,-0.042783987,0.022616005,0.047362443,-0.043379333,-0.014746116,0.035089064,-0.054160353,0.046350203,0.06241209,0.03280734,0.055123255,-0.019705312,0.020643286,-0.016507411,0.110808276,0.04363638,0.07937912,0.04192369,-0.04494343,0.0046931542,0.031121429,-0.09297232,0.056370437,-0.09929708,-0.055800166,-0.016174842,0.042733565,0.05061112,-0.014593863,0.016586358,-0.09470283,0.02264621,-0.05339491,0.09405837,0.034224633,-6.87514e-33,-0.068209246,0.12964348,-0.044724077,0.020035272,0.08383576,0.037575915,-0.018879447,0.03254682,0.06555419,0.020750625,-0.023581626,-0.06575875,0.01654811,-0.017060006,0.024614543,0.019089537,0.0010291735,-0.08484615,-0.03885159,-0.010809258,-0.07673872,0.13757317,-0.17309448,-0.007345566,-0.054568436,0.10625953,-0.08285246,-0.043367013,-0.10185717,-0.011089005,-0.038547825,-0.01677925,-0.031332336,-0.0057452787,-0.091666475,-0.0052545257,0.02196842,-0.06654213,0.0064263665,0.008826504,0.037124503,0.11393325,0.0051901084,-0.04076622,0.048808713,0.051653,0.032215662,0.051066075,0.069386356,0.0062026624,0.016789118,0.08772376,0.013304312,0.03192333,0.05197662,0.029835794,0.037821654,-0.053523716,-0.08092984,0.0141652515,-0.018840766,-0.078005835,0.0061370567,0.046775106,-0.025403524,0.055954475,0.042648766,-0.11856903,-0.01267565,-0.0009503404,0.06693322,0.008904053,0.015031515,-0.12668593,0.04690865,0.034439284,-0.1080246,-0.025121843,-0.058932897,-0.0109394705,-0.031831812,-0.029795865,0.033562943,0.045184772,-0.049897395,-0.011233084,0.009249404,-0.1105242,0.030260473,0.05199278,-0.08861445,-0.022577872,-0.09579607,0.046371568,-0.0093659535,-6.652266e-08,0.017027942,-0.044816382,0.020322068,0.020483224,0.06771986,-0.029515838,-0.005461719,0.11853849,0.0074196504,0.02988845,0.08320792,-0.039015483,-0.056412082,-0.017320806,0.07843403,0.02153754,0.048886806,-0.02670489,-0.04241807,-0.065067135,-0.028469948,-0.021370744,-0.05636759,0.018870719,0.039955657,0.018527983,0.058973886,0.055865567,0.031486597,-0.0006772386,-0.023887154,-0.0148383435,0.048866592,-0.04926144,-0.0045390306,-0.014699801,0.03895926,0.034638572,-0.054929614,0.032737073,-0.06527087,0.06423873,-0.07880457,0.013305044,0.0041081277,0.037140694,-0.016870607,-0.005832868,0.06412292,-0.012657319,0.040223487,-0.0684239,0.0076342323,0.018864213,-0.016662747,0.046018995,0.021830322,0.00948667,0.0153417885,-0.007937937,0.025865393,-0.015699733,-0.07771311,-0.030457992,6,-2.916691,25.438738,8
29,"we began by using pivot tables in excel to combine big data grouping and summing up values to speedily calculate the important metrics such as totals, averages and counts. we followed this with exploratory data analysis (eda), where we employed summary statistics like mean median, variance and standard deviation together with visualization tools like histograms box plot '' and scatter plots to derive insights about data distribution finally we briefly discussed issues such as class imbalance and presented feature engineering and data transformation methods that are important to improve data quality and ready data for deeper examination.",0.07826344,-0.0069432035,0.041027695,-0.036419492,-0.030541392,0.009538154,-0.10673817,0.008404567,-0.037218727,0.050119992,0.0012655939,0.009435125,0.013948644,-0.036071632,-0.03426008,0.012073866,0.037992485,-0.0059060464,-0.044122774,-0.06361542,-0.017156206,-0.022084,-0.017518707,-0.012022646,0.07761698,0.04772493,-0.026350485,-0.050272975,-0.013487693,-0.06333629,-0.046690345,0.065007254,0.04590262,0.03648294,-0.12964511,-0.012390799,0.044583123,0.07657942,0.03940122,0.0059965593,-0.0061493027,-0.02772766,0.045124482,0.011810282,-0.022806024,0.0356547,-0.0476236,-0.07788798,0.03411319,0.07324804,-0.08757208,0.076587655,0.01550787,0.06322559,0.06410567,-0.024768364,0.018920366,-0.06915464,0.04641159,0.033314165,-0.05148191,-0.0060415263,0.07498013,0.040954344,0.021425823,-0.024210038,0.03732695,0.07140352,0.024682103,-0.005001005,-0.0034902364,0.05953147,-0.07365961,0.03823004,0.01452527,0.06351774,-0.078477696,-0.032328587,0.02116455,-0.009467687,-0.047806393,0.04472373,-0.039485972,0.080265746,0.04813488,-0.014776251,0.04973899,0.017403863,-0.12988895,0.012347765,-0.008958451,0.09357295,0.041946337,0.0078101186,-0.08361714,0.05117942,-0.036155023,-0.08404905,0.06458582,0.018782254,0.019564394,0.03484951,0.04666931,-0.1134437,-0.01968124,-0.13858527,0.090779305,-0.0021478245,-0.04153279,-0.0784752,0.03592877,-0.058455687,-0.10037935,-0.04636243,0.012627781,-0.038320553,-0.03809273,0.023688983,-0.05054201,0.021709496,0.04396094,0.020750156,0.008232114,0.030122556,0.04095101,0.05184258,-0.086307034,5.6824157e-33,0.007666148,-0.084480226,0.02339742,0.053827144,0.02101608,-0.05547997,-0.046099387,0.06828453,-0.004221008,0.061463602,0.034483295,0.15511405,0.029295053,0.066003,0.06252983,-0.0035593265,-0.039815817,0.061740298,-0.043175966,-0.03621274,7.810965e-05,-0.09204443,0.074435726,0.043313,0.033079043,0.043978788,-0.014882867,0.017516073,0.014205172,0.010027685,-0.03851672,0.002804044,-0.031711783,-0.03550056,-0.008124995,-0.07103219,0.006035003,-0.030678289,0.08267096,0.09044229,-0.04198419,-0.0108420225,-0.100304045,-0.051007587,-0.02449843,0.083193384,0.034851838,-0.012142784,0.09058281,-0.002514159,-0.018091435,-0.11268058,0.04725956,0.040569007,-0.047135692,0.084398456,0.0005994184,-0.057322264,-0.034363475,0.050153572,-0.08163385,0.04793428,6.793486e-05,-0.0030586636,-0.048061118,-0.03122259,0.0142068425,0.09855919,-0.004577751,0.01633727,0.028554454,0.015164232,-0.057638433,0.03220926,0.025960334,0.016221985,-0.01692854,0.09575997,-0.047971956,-0.025192305,0.011698572,-0.037111443,0.055187754,-0.07775981,-0.016455911,0.05735548,0.06607843,0.037864514,-0.02730075,0.007719175,-0.050397158,0.0043575773,-0.01870418,0.011954341,-0.03696102,-5.387846e-33,-0.13243099,0.13756461,-0.036115576,0.052874945,0.07821162,0.062823586,0.0005761321,0.0204031,0.04540412,0.07245998,-0.047665756,-0.062342603,0.028905753,-0.04902433,-0.003695347,-0.047539044,0.013157664,-0.042369124,-0.06418544,-0.0388226,-0.019809358,0.06500502,-0.03910117,-0.014256,-0.030796519,0.040336873,-0.13293241,-0.05864098,-0.0056931973,0.018495152,-0.0017043652,-0.036273368,0.00088633795,0.0048801666,-0.05543669,-0.02528353,0.05553889,-0.0849385,0.011409704,0.049483955,0.047419887,0.008779775,-0.036851685,-0.024995908,0.011540448,0.016398223,0.04265742,0.012971949,0.029403578,0.016952084,-0.021834178,0.12448235,0.010648471,-0.0027952727,0.04863025,-0.052810498,0.05137894,-0.023741802,-0.069587804,0.0064869057,-0.083202295,-0.043393742,0.021628622,-0.0063612307,-0.0020120621,-0.027079294,0.06394819,-0.09693234,-0.10363934,0.03714111,0.006407372,-0.058516514,-0.0032524352,-0.046286676,0.0034337977,0.034244534,0.0028807344,0.00085680047,-0.033769917,0.026940161,0.06866475,-0.07578993,0.031661537,0.01293097,-0.022397604,0.036006313,0.006075997,-0.03045927,0.042475287,0.06976481,-0.11289466,0.033780005,-0.07676333,0.0025256893,0.043565117,-4.5973426e-08,0.02986212,0.009824021,0.030581493,0.01983116,0.038516235,-0.044215348,-0.06379854,0.22366324,-0.04369125,0.041412875,0.03243487,-0.026040547,-0.066179976,-0.0336277,0.09639974,0.048432402,0.009080949,-0.0037370913,-0.009363218,0.00068571226,-0.04174461,-0.022504594,-0.01541014,-0.024974298,-0.014875282,-0.029283889,0.02391614,0.06574124,-0.003549159,-0.04801754,0.001985165,-0.023142468,-0.067380965,-0.032076217,0.025719335,0.005984589,0.020536732,0.051808342,0.009522169,0.05630054,-0.07373569,0.067086086,-0.035718627,0.048740346,-0.007969445,0.050401,-0.069000944,0.03876176,0.037306115,-0.024467697,0.0060286056,-0.062235612,0.044648316,0.015294202,0.0007144973,0.08466978,-0.021800255,-0.018149616,0.09711254,-0.058060274,0.04155001,-0.040048476,-0.07228549,0.0023445121,6,-7.0854025,27.587524,8
