286,"class started with pivot table. dependinv on the level of details want, we are going more levels deeper. we saw conversion of histogram to box plot in excel to have an idea about outliers. most common submission lie in a band. we used line diagram for dates and total characters/avg characters. mainly we learnt about exploratory data analysis, and infer from there trends and analysis we can derive. we can check for anamolies.
we did another case study on the plant with 241 columns. manipulating to get desired analysis. then finally we had discussion on e2 assignment",0.0570711,0.010715168,-0.019994311,-0.0143576525,-0.031518113,0.03082476,-0.06449475,0.05506465,-0.054819174,0.04842365,0.037087414,-0.02553566,0.059298206,-0.031635836,-0.084374145,-0.009629092,0.014632321,-0.0189074,-0.03482916,-0.06484963,-0.022769608,-0.0042338413,-0.02874336,-0.05083554,0.03557738,0.03788203,-0.038230076,0.031014074,-0.041692372,-0.15636139,-0.06388592,0.07383392,0.070090264,0.047102697,-0.065177776,-0.037622463,0.030495716,0.026558233,0.050722614,0.029362535,-0.028951425,0.006078144,0.092996016,0.021934325,0.0016177692,-0.021868957,-0.118902646,-0.08332068,-0.026378617,-0.039943084,-0.049948085,0.02855247,0.019453477,-0.031281967,-0.008233643,-0.06507348,-0.0038786016,-0.07852456,0.082974896,-0.03770402,-0.019908156,0.07272188,0.012245671,0.0050462363,0.02474172,-0.03708764,-0.026050568,0.06876453,0.04358295,0.039876796,-0.022903787,0.03697098,-0.07597714,0.023596011,-0.026150798,0.039921902,-0.08180965,0.0076170787,0.027077112,-0.06726684,-0.029204158,0.030409344,-0.014806843,0.03980092,0.009197273,-0.0439655,0.013299826,0.06830624,-0.030837486,0.043746594,0.032839455,0.04345679,0.081195556,0.04786299,-0.0512016,0.083260685,0.047074568,-0.06793723,0.09556695,0.05164061,-0.024119785,0.0139442,-0.06638243,-0.043020282,-0.032378983,-0.079830006,0.08225641,-0.04193819,0.016314412,-0.07659002,-0.013161455,-0.0746533,-0.12547028,-0.06704327,0.041946184,0.0041552912,0.040585082,-0.010092057,-0.06523753,-0.034403548,0.03713997,0.015048719,-0.011919199,0.05741628,-0.025265586,-0.021668024,-0.11655072,5.6140284e-33,0.0049731988,-0.012492544,-0.048683155,0.070912,0.04678202,-0.010374456,-0.075612634,-0.013884708,0.053156912,-0.009919682,-0.031088509,0.0939426,-0.0067830835,0.04403361,0.032482155,0.011919541,-0.019622235,0.01689306,-0.053947162,-0.009327128,-0.015115175,-0.08927779,0.043106038,0.0209891,0.072249845,0.08428114,0.02172613,-0.056327455,0.037351187,0.011425366,0.10529793,-0.028134488,-0.040770765,-0.017051555,0.014027912,-0.08271349,0.0146371955,0.021331802,0.083303,0.04956638,0.04083481,0.002339957,0.0051612933,-0.0056533436,0.005894562,0.09962691,0.06429322,0.03453093,0.07141815,-0.03084527,-0.052887,-0.030525057,0.08430405,0.009838814,0.015521751,0.028165739,0.028770123,-0.0072850143,0.020637974,0.090407364,0.026841408,0.058654547,0.0388334,-0.030783942,-0.014213894,-0.032647155,-0.07913416,-0.03277384,0.0053546787,0.05144803,0.011437371,-0.024477178,-0.04608227,0.0022319416,0.014779553,0.041033775,-0.004302266,0.02870123,-0.05384617,-0.047986757,-0.016114822,-0.04593677,-0.0017570725,-0.1278175,-0.10008935,-0.040375985,0.03755456,0.0066363662,-0.050738484,0.0860227,0.047415406,0.013314443,-0.063062385,0.021757877,0.069852665,-5.5631405e-33,-0.06972372,0.17751487,-0.020982949,0.010786981,0.09561139,0.035668537,-0.053381015,0.00043934942,0.13226506,0.09576121,-0.090418324,-0.021972986,0.054093763,-0.010846444,0.022188421,-0.022674533,0.0040432266,-0.01743703,-0.066217944,-0.020517457,-0.0768005,0.112392,-0.07653918,-0.0244095,0.025502123,0.108616285,-0.08297898,-0.04406272,-0.095794104,-0.031528894,-0.079769254,-0.04766139,-0.024111053,0.022184175,-0.11089857,0.02736135,0.03173727,-0.08283831,0.019809585,0.028656034,0.015870932,0.058212314,-0.026336115,-0.023026614,0.035146054,0.06567778,0.003077436,0.106911555,0.06839902,0.046080276,-0.027227324,0.13152902,0.015673956,0.03195919,0.027813962,0.018115489,0.050659534,-0.034723926,-0.048571806,0.073244624,-0.033258464,-0.046726886,0.018786525,0.006371553,-0.027505057,-0.024772568,0.017126745,-0.047405448,-0.029144207,0.033609714,0.052470423,-0.048543707,-0.012328657,-0.061385933,0.028134424,0.037538424,-0.05619838,-0.00435686,-0.042775657,-0.021903204,-0.040817488,-0.038482048,0.07608094,0.04273145,-0.01632292,0.007514265,0.0055845645,-0.07013004,0.04282531,0.09767004,-0.053709667,-0.01565865,-0.053288266,0.0066748676,0.06785666,-5.7402435e-08,-0.04153514,-0.0643264,0.011970957,0.020361254,0.084975146,-0.028684529,-0.077603675,0.11098866,0.013454253,0.09369504,0.04259095,-0.04105416,-0.052023843,-0.0068024686,0.06423181,0.023582844,0.035329696,0.0971017,-0.061498526,0.014263941,0.0037664948,-0.009380912,-0.016673543,0.012937599,-0.033833805,-0.031948272,-0.04044495,0.05805738,0.033084426,-0.021279853,0.03194078,0.00463304,0.029537221,-0.064963974,-0.016774273,0.015328635,-0.033984035,0.005698695,-0.034878094,0.05952901,-0.012539675,-0.010119303,-0.06484076,0.026190596,0.010992653,0.04754628,-0.06838354,-0.042621326,0.051257737,-0.07936105,-0.029291162,-0.076936506,0.016018135,-0.02666047,-0.021511713,0.029305648,0.007765211,0.029120544,0.07776131,-0.034386933,-0.027576141,0.065978214,-0.042712204,-0.015332727,6,-3.9322398,26.601664,8
315,"in today's session we we started with pivot tables and how to use them to draw inferences from the data using min, max, std dev etc. it's a necesssary part of the exploratory data analysis. then we saw how to see how many outliers we have and how they vary within the data by using line plots, histograms, scatter plots and box plots. the decision boundary which is usually between q1-1.5iqr and q3+1.5iqr can be changed according to the data and its just a common practice to use 1.5 and we could have higher or lower number than that according to the data we have. if in our data we have large difference between mean and median, the mean is severely affected by the outliers and hence it indicates that the outliers exist in the data. outliers are not always insignificant and they may be telling crucial exceptions that may be occuring in our system and its useful that way in telling us about the potential failures in sensors and other things. later we discussed two industry projects where eda was heavily utilised in getting insights from the data and raising necessary questions which would later be utilised to solve the data on a large scale. ",-0.007610614,-0.0059633926,0.024479862,-0.034222465,-0.017365193,-0.029983591,-0.020127412,0.12941858,0.04710985,0.07908556,-0.009265282,0.03836993,0.07309891,0.0052846526,-0.028743468,-0.04932924,0.048010945,-0.040059745,-0.07577275,-0.025047313,-0.040565193,-0.04408139,-0.08575175,-0.009049264,0.023777613,0.014172094,0.004145895,-0.028191384,-0.038262807,-0.07116498,-0.008738545,0.06661122,0.046711653,-0.030989148,-0.06601573,-0.067882605,0.06771069,0.02445018,-0.003895005,-0.0014417205,-0.023151241,-0.03636956,0.016686624,-0.03672672,-0.018948823,-0.05222142,-0.09454633,-0.11577151,-0.062457528,-0.023815457,-0.085485615,0.046265665,0.021846987,0.005761619,0.036003835,-0.048649997,-0.023658147,-0.061663836,0.028738048,0.015618415,-0.05565295,-0.006063325,0.026037047,-0.026871685,0.07437256,-0.048775677,0.05575736,-0.004505706,0.023809247,0.09184786,-0.020723842,0.030082764,-0.10564427,-0.045849163,0.018248389,-0.011095718,-0.09629404,-0.00584801,-0.022449544,-0.08790467,0.04715284,0.07430021,-0.07528786,0.03497588,0.05343399,-0.004608165,-0.0063705766,0.020643542,-0.014580711,-0.02234304,0.036473855,0.040395074,-0.0321771,0.044080682,0.079372935,0.08302377,-0.038436092,-0.010690301,0.107020065,0.004607325,0.032591946,-0.04378224,-0.03272218,-0.011581449,-0.009873184,-0.09686536,0.06742782,-0.027101113,-0.024647415,-0.047669116,-0.011133265,-0.041214664,-0.05225709,-0.03149628,0.050168753,-0.07520648,0.01954941,0.024967343,-0.040405404,-0.048523124,-0.008576692,0.001650274,-0.0028235018,0.08031179,0.03312811,0.059262816,-0.0963473,7.415357e-33,0.009541721,0.024101501,-0.011612574,0.012304212,0.0007514053,-0.012322823,-0.061717577,-0.018809639,0.09093912,0.047178805,0.025923444,0.08937624,0.07080604,-0.0027759185,0.094036505,0.012643068,-0.009691528,0.027917163,-0.05664694,-0.04833428,-0.011598925,-0.12842827,0.021370469,0.07211079,0.06362104,0.083109,0.020841094,0.03208043,0.0070028543,-0.020161364,0.030702388,0.021914167,-0.026141314,-0.014021576,0.0034745142,-0.007211815,-0.028237123,-0.016135361,-0.014239953,0.05868914,-0.043589592,0.008667117,-0.012260157,0.028402178,0.057964083,0.0944684,0.007920286,-0.0028619445,-0.04606319,-0.056497175,-0.031551316,0.014986357,0.121465504,0.041504014,0.030531604,0.002834937,0.004858472,-0.10467345,-0.0049616834,0.06357488,-0.034630444,-0.0018628652,0.013121123,-0.0278772,-0.00086332276,0.04368351,-0.005030655,0.117406495,0.01563219,0.070844576,-0.01704875,0.02338584,-0.069657184,0.016311232,0.038826033,0.016504172,0.0027284098,0.06212539,-0.003890377,-0.07695302,-0.022237437,-0.018743286,0.008748476,-0.076772764,-0.06211283,-0.01764844,0.0586364,0.021050487,0.00010051756,0.0056634895,-0.034062658,-0.011652673,-0.018514197,0.047627404,-0.06479009,-8.404517e-33,-0.13165654,0.09466634,-0.02343234,0.029478611,0.025834236,0.05102952,0.052940086,-0.026430696,0.11287541,-0.035530526,-0.10607882,-0.035037547,0.030688023,-0.023645911,0.033631533,0.023183256,-0.037344955,-0.12622544,-0.063327156,-0.030797094,0.013196025,0.020652156,-0.1163823,0.018468184,-0.016036682,0.104765065,-0.09982927,-0.07765181,-0.09682515,-0.06254924,-0.024906129,-0.061042555,-0.029001059,-0.034049995,-0.0479022,-0.020268552,0.052294586,-0.06594008,-0.05013825,0.025707541,-0.0502126,0.07468487,0.02847967,0.02371177,-0.019505488,0.05735094,0.008327114,0.035801847,-0.0116008455,0.011111253,0.040440485,0.09238802,0.02063303,0.041253284,0.002478386,-0.0225662,0.07115938,0.02128666,-0.0353399,0.08360067,0.02231496,-0.009893639,-0.03872555,0.01823135,-0.025225053,0.014768959,0.05547805,-0.14357243,-0.026081782,-0.014802733,0.008364034,-0.107474044,-0.013207538,-0.047311407,0.025813542,0.045089133,-0.073513485,-0.03315959,-0.04773619,0.049582813,-0.023617616,-0.118580736,0.060295157,0.024496287,-0.04428525,-0.0023250973,0.033409785,-0.037361804,0.044968203,0.0068950253,-0.095467396,-0.04321379,-0.107384585,0.015715402,0.013543353,-6.974957e-08,-0.01726305,-0.03904704,0.0053749103,-0.015217354,0.065647535,-0.0138875935,-0.04303464,0.18575098,-0.01323869,0.028079681,0.074235216,-0.06546145,-0.06421949,0.0162946,0.14704962,0.026866224,0.0513528,0.019466462,-0.028451376,0.0040580328,-0.02825102,0.05128786,-0.068964474,-0.013433534,0.013425783,0.012683156,0.020852437,0.12329767,-0.053582318,-0.0006148727,0.026067918,-0.029141663,0.102662005,0.036330003,0.045757294,0.033501223,0.0032719607,0.012156372,0.013810068,0.041968722,-0.050944872,0.020850528,-0.0044979793,0.04956659,-0.029476112,0.006308382,-0.09495153,0.04791046,0.020647453,-0.049927898,-0.05928883,-0.07495739,0.035254978,0.03764218,0.030911032,0.00476408,0.04063394,-0.013352168,-0.023393909,-0.0022665714,0.07034422,0.0042742165,-0.07836399,0.000958133,6,-2.2023623,26.824219,8
318,"in this lecture, we continued our discussion on eda. we learnt how to create pivot tables in excel, which summarize the entire data into a table, whose entries can be chosen by us. this will help us create a summary of the data and understand the various trends and patterns in the data. using the pivot table entries, one can then create plots to analyze the distribution/ pattern in the data. this can be used to predict any desired value in future. the example which we discussed in class was that of the average number of characters in the summary on any particular day. this can be useful to predict the approximate number of characters in the summary of any day in the future.
we can use various plots including- box plots, scatter plots, histograms, as well as descriptive statistics function in excel to determine the outliers in the data set. any of these can be used to reach out to a conclusion regarding the outliers. also, it is not always correct to completely disregard the outliers, as they may also reveal certain important problems, patterns in the data, which cannot be ignored.
eda includes all these tasks of cleaning, comprehending, analyzing the data and extracting valuable insights from it, which can be further used to build a model. 
apart from this, we also looked at two case studies. one was regarding the measurements of numerous different parameters related to a process in chemical plant, with the measurements collected on daily basis. we created a pivot table which included the various parameters in the columns and the dates in the rows. then we added the values of- count of the total measurements made in that year, the average, max, min of these measurements for each of the parameter. we observed in some cases, the min value of the parameter dropped to 0, which cannot be practically possible, as we cannot have 0 pressure or temperature. the problem occurred due to the missing values of these parameters on some days.
the next case study was about the creation of energy using solar radiation. the oil and water temperatures were recorded at different time intervals, and the data was available. various line plots were created to analyze the variation in these temperatures at different times of the day and further on different days.
correlation maps were also made to understand the correlation between the various independent variables. there were certain patterns in the temperatures, from birdâ€™s eye point of view. however, more distinct patterns were observed within these large variations, when looked through a zoomed in perspective, suggesting hour-to-hour as well as daily variations in the temperatures. all these plots could be analyzed, to help us understand how we can separate the noise from the signals, identify the outliers, and use them to predict the values of the output variable in the future.

",-0.06337066,0.027048199,0.024198415,-0.0017348396,-0.051846176,0.015765443,-0.048998073,0.064915806,0.026719522,0.06576153,0.0022331106,0.0035364993,0.025474323,0.011402627,-0.022123015,-0.04227083,0.04749698,-0.024503117,-0.058983214,-0.044181775,0.01325488,-0.013472602,-0.057159666,0.0004608425,0.03410851,0.054316726,0.0438842,0.020312225,-0.09004517,-0.07136454,-0.007231164,0.048577387,0.031039333,0.051588066,-0.10251671,-0.04579643,-0.012233745,0.06344805,0.097425096,-0.014435097,-0.0016208107,-0.008537051,0.07055622,0.024506254,0.03582801,-0.07979975,-0.10521084,-0.074936256,-0.0028079972,0.032389447,-0.08972501,0.06766019,0.028147908,0.027791204,0.052989442,-0.006754255,0.024369793,-0.13122042,0.07782371,-0.06667867,-0.047648568,-0.0053707375,0.022348315,-0.01495979,0.015599486,-0.011224612,0.015420199,0.031998225,0.005105067,0.056663603,-0.05253975,0.06323787,-0.07693895,0.047307584,-0.008134944,0.04300122,-0.09757469,-0.03811206,-0.014294355,-0.03613982,0.02540742,0.076326124,-0.019641591,0.07427927,0.032406062,-0.0033321164,0.04257315,0.074219696,0.015552646,0.0012839006,0.019517438,0.0073681865,0.05023338,0.02809024,-0.021471625,0.041941322,0.007786721,-0.084095515,0.07139472,0.030560844,0.012183708,0.01611104,-0.021959808,-0.09464562,-0.07089429,-0.099800356,0.078061126,-0.037029356,-0.059198238,-0.06851195,-0.018537838,-0.05855242,-0.06435728,-0.037878536,0.026732195,-0.066104725,-0.017635198,-0.04630016,-0.030935932,0.023126578,0.012471756,0.0021083555,0.017821712,0.09791666,0.00437838,0.0056434833,-0.08686656,3.3249717e-33,-0.0148044815,-0.019588685,-0.02926009,0.039592903,0.014231889,-0.025948456,-0.056934215,-0.041242268,0.088591695,0.026205914,-0.027262717,0.13759892,0.020064116,0.08117165,0.03683065,0.044042256,0.063548736,0.04463229,-0.07377658,0.022702886,-0.009390307,-0.14586811,0.09115711,-0.039952036,-0.0012665434,0.066387385,0.037213977,-0.029752586,0.04225354,0.0030823199,0.060423497,-0.02156347,0.0036819582,-0.04714363,0.06286563,-0.0347226,-0.040664073,-0.00034166657,0.077157,0.085817784,-0.01672356,0.007460701,-0.021032967,-0.041718263,0.026158445,0.09214386,0.034540024,-0.0035001617,-0.013348361,-0.0306775,0.021841682,-0.07991531,0.033621173,0.013351438,-0.032335516,0.023346752,-0.023259308,-0.08351026,0.019567931,0.029666064,-0.01943438,0.025439147,-0.01650124,-0.03775701,-0.05476003,0.031760186,-0.041776594,0.04701186,-0.005178082,0.026245425,0.061828997,-0.009787699,-0.01373699,0.017017461,0.005152387,0.031191511,0.05122981,0.060799215,-0.039181907,-0.011272904,0.034041397,-0.047202066,0.02169397,-0.110169426,-0.044546336,-0.03173384,0.092335954,0.053486247,-0.048524674,-0.07532401,-0.028139615,0.019972822,-0.052265294,0.04574962,0.00782185,-4.7329906e-33,-0.043361258,0.1475833,-0.06132926,-0.02906918,0.05838051,0.0316185,-0.06455622,0.024486752,0.10676695,-0.016855882,-0.10624301,-0.071464114,0.036290772,-0.043519996,0.03385051,-0.036539074,-0.0041205147,-0.040154412,-0.089236505,-0.018220251,-0.032694384,0.0045906864,-0.09560151,-0.03320633,0.043618273,0.07364172,-0.049515404,-0.03334841,-0.1063237,-0.038835227,-0.04318692,-0.02114377,-0.0069931084,-0.0035578595,-0.08977663,0.020373981,0.04842987,-0.1098515,0.0052091763,0.011750558,0.032705504,0.03433687,0.049114082,-0.0013900528,-0.009107716,0.04766794,0.014026956,0.08644835,0.017678315,0.07531732,0.00799797,0.098859906,-0.0008219403,0.021638175,0.034611367,0.015462957,0.052223876,-0.02427729,-0.07262493,-0.0075290464,-0.05485027,0.012600248,0.023261916,0.037514184,-0.039709836,-0.01688793,-0.0064140293,-0.15087593,-0.020951595,0.04978272,0.06642444,-0.03649866,-0.043649644,-0.047465917,0.017946176,0.032251913,-0.111004665,-0.005941004,-0.021260997,0.05258843,-0.08010546,-0.0655809,0.06681576,0.020169063,-0.036240287,0.0260786,-0.013808781,-0.03632193,0.018416645,0.059405405,-0.09231614,-0.064499855,-0.0627987,0.044591077,0.047361925,-5.7165224e-08,-0.033946358,-0.056543116,-0.013315204,-0.01312258,0.047062658,-0.059713036,0.009316271,0.113075845,0.019954579,0.0009874856,0.15247025,-0.07211871,-0.07594481,0.015217342,0.089776225,0.10399425,0.097663134,0.06380397,-0.027931439,-0.008989868,0.060705736,0.0066316393,-0.034788694,-0.0012794982,0.0044216635,-0.006550949,-0.025412027,0.10545094,-0.055985864,0.041053146,0.034648053,-0.04528782,0.020870388,-0.07105637,-0.012739091,0.035882294,0.08209266,-0.016219122,-0.011365161,0.049088836,-0.000631253,0.05327972,-0.02529493,0.030917078,0.04411581,-0.025577495,-0.034251034,-0.004153892,0.027023047,-0.05985919,-0.03180373,-0.084700674,0.006033725,0.023117686,-0.027375871,0.06199577,-0.00077391684,0.012904845,0.031419568,-0.038835473,0.038180623,0.033194296,-0.07095078,-0.015119231,6,-4.159762,27.459784,8
350,"discussion upon exploratory data analysis was taken further.  example of average words per summary was taken , upon which we did statistical analysis. pivot tables can be very helpful in such cases. another example of a chemical factory plant was taken up . we analysed a column of the data and made out various references from it .",0.05613662,0.01195439,-0.025111409,0.020773571,0.0075068506,0.054467656,0.003969143,0.07759858,-0.021810533,0.0466943,0.051461898,0.026892837,0.05784618,0.01471414,-0.056905173,0.044138905,-0.003912144,0.04427585,-0.048574395,-0.12508653,0.018574715,-0.011911431,0.024053056,-0.0038908871,0.07914792,0.041518725,-0.09688345,0.026054127,-0.005543264,-0.018117717,-0.05971582,0.116600655,0.11917406,0.03369709,-0.019734196,-0.027433578,-0.025781825,0.124467485,-0.0128597375,0.02174772,-0.057149142,-0.0035673806,0.03451411,-0.012428634,0.02856031,-0.031230085,-0.06755497,-0.08260681,-0.066765614,0.026194906,-0.10698433,0.050016563,0.030146318,-0.0057192165,0.0017246464,-0.060923424,-0.01975569,-0.046812706,0.026036153,-0.033821978,0.009626894,-0.06581568,-0.020226436,-0.017900107,0.022236215,-0.021159487,-0.017856548,0.053861354,0.0009957317,0.023506105,-0.047945693,0.042227965,-0.03629581,-0.01629501,-0.08276566,0.09233781,-0.020576704,-0.019982567,0.014853865,-0.023093358,-0.031816795,0.026711902,0.009524376,0.03379836,-0.0048223687,0.00023016823,0.068099886,0.016610619,-0.04265012,0.037441604,-0.0230033,-0.050622594,0.05931382,-0.06196484,0.015193013,0.02239681,-0.0085735535,-0.12076199,0.1341633,-0.0060622753,0.034318175,0.05812524,0.03427895,-0.055298243,-0.10050811,-0.0826915,0.044878267,-0.040397335,0.017776942,-0.0059598507,-0.077723354,-0.01506865,-0.093525685,-0.023279006,0.027088083,-0.110841274,-0.035144083,-0.058392104,-0.049745515,-0.032569367,0.003293215,0.034947403,0.050365817,0.05677364,0.019858873,0.048212282,0.025975896,2.7632513e-33,0.031536516,-0.022168277,-0.050414514,0.073673286,0.01985686,-0.047877498,-0.01696133,-0.0026299923,0.01579577,0.013903023,0.068172805,0.0983719,-0.020505892,0.027145486,0.030068135,0.021901973,-0.02417711,0.082544215,-0.029570699,-0.037051413,0.014779199,0.009614874,0.07812361,0.0023461864,0.07132665,-0.028788503,-0.019940231,-0.03394522,-0.042975497,-0.022983603,0.085582815,-0.016984351,-0.057351843,-0.0021959862,0.010289157,-0.042926867,-0.0005187548,0.026705367,0.06002357,0.045689125,-0.021959726,0.0014311273,0.028628457,-0.012844614,0.01853378,0.11243958,-0.012374846,0.017182518,0.1033617,-0.0045157964,-0.06048855,-0.034023207,0.0640533,0.030946804,0.035109602,0.098022446,-0.07632361,-0.058303405,-0.0150502315,0.057638675,-0.047943585,0.08912175,0.0002797421,-0.050892305,-0.009994952,0.045892965,-0.056819957,0.061673734,0.067154855,0.027608963,-0.02314337,-0.007803036,-0.021851636,0.037849177,0.030713884,0.04767156,-0.0350244,-0.02742929,-0.10422852,0.055751484,0.030155407,-0.07614371,0.025557715,-0.10550017,-0.06895935,-0.0077303653,0.048461102,-0.06462315,0.011024693,-0.042932916,-0.03660295,0.022780027,-0.05669546,0.028646206,0.03346107,-5.473884e-33,-0.08079904,0.02575322,0.031545356,0.028195154,0.0075688176,0.057910025,-0.05856321,-0.034287047,0.09073854,0.020143302,-0.087011516,-0.0377107,0.06601429,-0.013220624,-0.04351671,0.009223273,0.019751277,-0.0070921755,-0.0029167463,0.0929068,-0.06949149,0.030050818,-0.057641048,-0.04287175,0.007070657,0.04977755,-0.044428654,-0.095818266,-0.08025398,-0.09596537,0.009067167,-0.027632799,0.005560234,0.057622515,-0.12300144,-0.08407168,0.031530876,-0.07143208,0.015117227,0.047615226,0.07563015,0.07700633,-0.0016722436,-0.015226185,-0.01929564,-0.07469897,-0.13343604,-0.029079808,0.036232255,-0.008881689,0.008184844,0.06176181,-0.02435981,-0.039259672,0.027143246,-0.061286326,0.08931843,-0.053232312,-0.069816284,0.03624279,-0.014337105,-0.015262395,-0.021498935,0.017490227,-0.0075870045,-0.04271231,-0.00077543885,-0.11857905,-0.087243564,-0.025165973,0.025407404,0.035210457,-0.016449863,0.004109044,0.069757015,0.022088725,-0.040581405,-0.0603039,-0.08460079,-0.03421534,0.08413143,-0.02748317,0.09307795,-0.057900917,-0.038511414,0.019221779,-0.02480065,-0.049539585,-0.0037597197,0.007716779,-0.07250888,-0.08901389,-0.042659268,0.05643991,0.04857947,-4.1289656e-08,0.016997607,-0.0076569025,0.07304913,0.07042632,-0.0096795745,-0.097182296,-0.03764133,0.11766059,-0.0536948,-0.011086782,0.00035060127,0.023867438,-0.080420986,0.043879483,0.056168854,0.0075445506,0.036202278,0.03889139,0.014941025,-0.037452463,-0.018614653,0.038709257,-0.08064031,0.032471515,0.050628208,0.018259563,-0.03052561,0.04249026,0.015264982,-0.00940082,0.08199464,0.025474273,-0.025856964,-0.062123008,0.036082406,-0.025318393,0.02836203,-0.071326286,-0.05338387,-0.016899306,-0.054234337,0.0752066,-0.049005236,0.024488416,0.04828828,0.055604123,-0.10800018,-0.001638813,0.057653952,-0.0644407,0.08181585,-0.03345822,0.058298092,-0.013651046,0.068176836,0.07459547,0.068925604,0.022041723,0.040043164,-0.06770992,-0.0047885105,0.057980783,-0.020383652,-0.026687676,6,-5.5542593,31.312315,8
