383,"variance inflation factor (vif)
purpose: detects and addresses multicollinearity among independent features.
process: involves an iterative approach to select independent features by evaluating their correlation.
key consideration: itâ€™s crucial to justify the chosen threshold for vif, as it determines the level of multicollinearity deemed acceptable.
principal component analysis (pca)
core idea: reduces dimensionality by transforming data into new axes (principal components) that capture the maximum variance.
principal components: components like pc1, pc2, etc., are ranked by the amount of variance they explain.
loadings: represent the contribution of original features to each principal component.
preprocessing: data normalization is essential before applying pca to ensure accurate results.
trade-off: while pca reduces dimensions, it often sacrifices interpretability of the original features.
visualization: pc1 vs. pc2 plots are commonly used to visualize high-dimensional data in a 2d space.
role in eda: pca is a valuable tool in exploratory data analysis for uncovering patterns and simplifying data.
comparison of vif and pca
order of application: vif should be used first to remove multicollinearity among features.
pcaâ€™s role: while pca effectively reduces dimensions, it can obscure the interpretability of the original variables.
t-distributed stochastic neighbor embedding (t-sne)
purpose: a visualization technique for projecting high-dimensional data into two or three dimensions.
methodology: utilizes t-distribution and gradient descent to map data points while preserving local relationships.
limitations: computationally intensive, non-deterministic (results may vary), and less consistent compared to other methods.
mechanism: constructs a probability distribution to represent the proximity of points in high-dimensional space, then reduces dimensions while maintaining these relationships.
applications: particularly useful for classification and clustering tasks, as it emphasizes differences between data points.",0.03152437,-0.07172075,0.0028083415,-0.030974207,0.049308404,0.01323845,-0.068600774,-0.018705828,0.02871703,-0.0032412743,0.012214576,0.01043199,-0.12332824,0.055659566,-0.027847549,-0.0022462746,0.096788466,0.019243572,-0.09674063,-0.04065696,0.059361406,-0.04836087,-0.06117782,0.0056600953,-0.0028164745,0.07105203,-0.026259867,0.031482264,-0.024780575,0.02837008,-0.00084651576,0.07902968,0.00090165023,-0.030849982,-0.030381732,0.034425847,0.041865613,0.037894685,-0.07684598,-0.0037929462,-0.016927049,0.012714119,-0.0028682998,0.038380243,0.11739912,0.0015414956,-0.059380494,-0.080503576,0.053600494,-0.008746959,-0.0089505,-0.024354562,-0.08205138,0.021621313,-0.02758176,0.03467602,0.0058933725,-0.100672044,0.06617814,-0.033873588,-0.051924895,0.019861095,0.031368736,0.027790878,0.093663804,-0.043685764,0.0111240065,-0.057873663,-0.03376735,0.01617589,-0.07368414,0.024696019,-0.01373329,0.015913999,-0.015987882,0.097535364,-0.08448298,-0.036252826,0.04576827,-0.061071374,0.0785068,0.12652536,-0.0052715125,0.0039553107,0.028876696,0.00701661,0.012392839,-0.0870573,-0.05398395,0.04782171,0.077753305,0.09372105,0.043456994,0.0048423903,-0.011432574,-0.01211173,0.02557857,-0.08801991,0.034125213,0.02405835,0.011605728,-0.077874556,0.049910698,0.057415035,-0.03250371,-0.07403197,-0.0011761395,0.020262081,0.03495432,0.0010395829,-0.05299567,0.007867721,-0.045656227,0.0012998948,0.073301144,0.045889612,-0.008033395,0.057367373,0.043579694,0.021430524,0.020899665,-0.06179277,0.06692732,0.016451288,0.056828074,0.049569488,-0.036869027,6.507682e-33,0.045787003,0.030014966,0.02912864,0.03277935,-0.047551733,-0.025751268,-0.008367803,-0.044179942,0.0466463,0.09421774,-0.008946707,0.06605012,-0.01714838,0.060613632,-0.024754446,-0.023887513,0.05274432,0.03824557,-0.024759669,-0.02199519,0.042245552,-0.06058567,0.0744494,-0.035717968,-0.03383354,-0.09754027,-0.099095725,-0.036530744,-0.05187483,0.0009994294,-0.061191175,0.020405099,-0.01709029,-0.011907935,-0.0867178,-0.084055595,0.029592164,-0.10957471,0.13094011,0.027326366,0.015191313,0.016989961,0.039627757,-0.07647827,-0.039129205,0.053872485,0.037774775,-0.027187543,-0.02901475,0.0021812043,0.017157985,0.017223146,0.011455316,-0.007990495,-0.04677817,0.06355717,0.061583117,-0.09392463,0.016364537,-0.03437525,-0.10656727,0.016168991,-0.034114808,-0.008522051,-0.043991674,-0.09517439,0.0041722106,0.03836319,-0.047218237,0.044578653,-0.048308548,0.004064999,0.0051489263,-0.053703025,0.021960925,-0.032863233,-0.055400703,0.047743186,-0.029380014,-0.02675841,-0.086551614,0.07439329,0.03191863,-0.05236561,0.007868521,-0.06413056,0.0062193247,-0.077721626,-0.05418442,-0.10388924,0.0043065893,0.058325034,0.101587385,-0.02975869,0.023962827,-6.989972e-33,-0.053463034,0.058592234,-0.00825333,0.06290205,0.062157433,0.0009257137,-0.044180628,-0.070543446,0.025264528,-0.088248394,0.063902594,-0.016466444,-0.012023842,-0.053149313,0.11030082,0.06934228,-0.021392483,0.0053635743,-0.016967481,-0.054219585,0.011455057,-0.10751429,-0.028371293,-0.024424393,0.0061282283,-0.04850352,-0.021957006,-0.119024485,-0.03426292,-0.005064955,-0.05172439,0.086521454,-0.012206635,0.07130749,0.02364261,-0.030046433,0.005800632,-0.14699864,-0.0076374756,0.07339939,0.046361204,0.09796072,0.021947203,0.016910685,-0.040384777,-0.020572571,0.071264625,0.052671663,0.06251394,0.033156168,0.014204387,0.06144111,0.029763611,0.02852125,0.01666408,0.046840668,0.08711259,0.0021300234,0.027108015,-0.004289258,0.06316433,0.009912876,-0.05616609,-0.035281084,0.012050159,-0.0103087565,0.06467675,-0.04812323,-0.02359638,-0.029400542,0.054054547,-0.011225352,-0.0072683543,-0.03965791,-0.044095326,-0.09810694,0.052123006,-0.00018892455,0.022946155,0.028661655,0.027101189,-0.050888818,0.030449457,-0.031450767,-0.020778222,0.1265727,0.034921695,-0.01186343,-0.014477371,0.0017491981,-0.044411615,-0.021866262,-0.043781705,0.059578866,0.05725521,-5.000087e-08,-0.073209286,-0.05988184,-0.047783583,-0.06799121,0.0016914865,-0.080935396,0.05790735,0.115071304,0.041217398,-0.010693555,0.11550018,-0.052596,-0.083752595,-7.1268194e-05,0.062878594,0.07149873,0.038234167,0.046714716,-0.042897325,0.052103773,0.019975837,0.023239296,-0.046375196,-0.072998606,0.0056264247,-0.05045333,0.026228217,0.13655965,0.07095325,0.014290048,0.010210753,-0.025542835,0.017867656,-0.034863416,-0.00371605,0.044463523,0.049519043,-0.000912891,-0.035480283,0.048807442,-0.050862502,0.032453813,-0.032674078,-0.030643934,0.021158677,0.06142512,0.018282402,-0.052553184,-0.011072531,-0.018538743,-0.054611124,-0.0052349563,0.017435946,0.08739963,0.046246998,0.064219944,-0.009612724,0.09909602,0.012126785,-0.050724596,0.01576601,-0.07784868,-0.043787904,-0.015992964,2,17.227537,16.409922,11
399,"in today's class we learnt some more things about variance inflation factor or vif. we latch on to the highest value and remove it and recalculate the vif. if we change vif threshold to like 5 then it will just be all those features with r square corresponding to five or less. if there is some important feature then we have to keep it irrespective of its vif. at last we can create classification model with left out variables.
then we learnt about pca or principal component analysis.principal components are necessarily perpendicular to each other. if we have 10pcs then we can decide like upto 2 or 3 are important .
eg - pc1 captures the best variance , pc2 : second best and so on....
now instead of y=f(x), we will have y= f(pc) ,  this is pc regression instead of normal regression , we can use pc for prediction but not for what if or explain the results.
purposes of pca analysis are dimension reduction, data reduction, prediction models and visualisation or understanding the structure of data using eda
pca is sensitive to data scale so we need to normalise the data beforehand.
then we learnt about t-sne or t-distributed stochastic neighbour encoding which helps to map multidimension data to 2 or 3 dimension",0.0035348998,-0.057650466,-0.030513933,-0.042274684,0.020732973,0.07069603,-0.062678665,0.047980297,0.059394527,0.059624758,-0.02970622,0.057932165,-0.09960639,0.0820366,-0.04424552,-0.04715259,0.07570844,0.06863825,-0.08034843,0.017391996,0.052357595,-0.06170828,-0.046844456,0.028713157,-0.068092234,0.058041062,-0.011340043,0.016148174,-0.0050263167,0.037767954,0.0070086294,0.05941284,0.04999053,-0.006450667,-0.083331436,0.024923133,0.017182367,0.034675106,-0.06295637,0.0358565,-0.0372233,-0.051980894,-0.046432763,0.052014746,0.1575635,-0.003117018,-0.008712646,-0.12457059,0.0017510689,-0.048042916,-0.036760356,0.016210135,-0.08289871,-0.017222622,-0.029047586,0.01225255,0.003041158,-0.084245056,0.0043324744,-0.063599445,-0.030347098,-0.04779707,0.0031762945,-0.002137889,0.06348114,-0.048710033,-0.022939261,0.032249954,0.025024178,0.036527365,-0.042012658,0.019249778,-0.016583996,-0.005353113,-0.03453395,0.04101987,-0.00030911234,-0.010230001,0.031355023,-0.0102674365,0.112472914,0.108902596,-0.00027087354,-0.023360366,0.017332193,0.017893797,-0.0054898043,-0.025009781,-0.061286025,-0.01850873,0.13525774,0.053984802,0.06529542,-0.02682153,0.046879113,0.002743494,-0.011284879,-0.102669306,0.06852426,0.00904125,-0.013342754,-0.041658487,0.033754792,0.03824081,-0.045811675,-0.055588678,-0.033960804,-0.003581316,0.07227567,-0.052638005,-0.0925122,0.051284313,-0.107714854,-0.027123094,0.09819755,-0.00942167,-0.024757598,0.07921808,0.05650893,0.01371267,-0.050788593,-0.066210665,0.023669759,0.035288062,0.091393046,0.023874722,-0.09392674,8.450379e-33,0.022957591,0.03284049,-0.03565293,0.043667708,-0.059436627,-0.029732605,0.05909197,-0.031973824,0.10272605,0.07079561,0.035755187,0.021395195,0.035356928,0.04227535,0.025563218,-0.0024524822,-0.017463356,0.023717167,0.014521045,-0.04019336,0.05267108,-0.044385705,0.16312,-0.017986633,-0.03960153,-0.08069143,-0.0868875,-0.06813407,-0.04656463,-0.024994873,-0.04348514,0.026360063,-0.04279931,0.02941289,-0.033363696,-0.04577816,0.021700481,-0.0713926,0.101891585,-0.03187008,0.017507946,0.036318757,0.05603802,-0.055491325,-0.015155888,0.046348546,0.025267815,-0.015223643,-0.08356176,0.026947716,-0.008855849,-0.015914535,-0.013690091,-0.021868477,-0.019309057,0.05179367,0.0420242,-0.080835566,-0.04884548,-0.022006106,-0.08362691,-0.0203373,0.006749777,-0.05336789,-0.028898926,-0.037581816,-0.008099708,0.017591668,0.0076614544,-0.012366791,-0.0438071,0.021001164,-0.065320924,-0.068393365,0.0664747,0.019009655,-0.053401195,-0.018206071,-0.00289002,-0.025458235,-0.09295466,0.11452009,0.0116007095,-0.06129604,0.02673622,-0.044446502,0.047475304,-0.09103777,0.030706855,-0.07105767,-0.04275712,0.0051903464,0.07940407,0.019305479,0.017361037,-9.08462e-33,-0.09647488,0.060286373,-0.09741183,0.09240793,0.019415919,-0.031442933,-0.037484903,-0.08836886,0.012569952,-0.07800439,0.05645171,0.027141001,0.042845614,-0.02262825,0.0035391804,0.05458331,-0.031886525,-0.024205372,-0.05595359,-0.07884569,-0.021669392,-0.047830224,-0.04990926,-0.0028968155,0.002308959,0.0026154995,-0.041257944,-0.060685545,0.010351127,-0.003485859,-0.047233555,0.04657072,-0.009738264,0.079485916,0.046449028,-0.023908446,-0.016638035,-0.07791058,0.04491179,0.08690791,0.035863854,0.1157809,0.03348497,-0.010941331,-0.06055807,-0.031556357,0.060960297,0.10723749,0.032172155,-0.029202541,0.10903419,0.02093145,0.03196592,-0.010659268,0.013158127,0.046272557,0.085688904,-0.051466215,0.034043822,0.028222883,0.07969785,0.013127686,-0.05526688,0.049520135,-0.07214922,0.049200144,0.03900737,0.033160962,-0.00418896,-0.059508797,-0.007123093,0.021635082,0.013084939,-0.018096915,-0.071175,-0.089432254,-0.009881565,-0.009550551,0.052210595,0.043576077,-0.034968935,-0.025439337,0.010535319,-0.05221613,-0.024030115,0.055985793,0.07840316,-0.026767276,0.031871658,-0.08200531,-0.046997834,-0.053038888,-0.01624643,0.06860891,0.075679414,-6.408001e-08,-0.05902897,-0.078390315,0.020295776,-0.037876476,0.059521925,-0.07086905,0.008199008,0.08332309,0.027996052,0.06301971,0.062265474,-0.008386673,-0.08135379,0.032068048,0.059805382,0.07934513,0.08415248,0.068975076,-0.041622557,0.023929227,0.03777787,-0.032769658,-0.038854618,-0.057310227,0.08453197,-0.066192485,0.009374931,0.09683955,0.038821418,0.04997199,0.0103987,-0.0070266123,-0.006774978,-0.028609585,0.015894752,0.058679964,0.04704964,-0.04290527,-0.02365676,0.044102773,-0.037230138,-0.06268576,-0.027278561,-0.01070577,0.010071081,0.044088166,-0.032997515,-0.017963624,-0.016963312,-0.023564355,-0.06902809,0.022041222,-0.022635821,0.038948786,0.033196103,0.05546658,0.022126202,0.012726232,-0.012995966,-0.06042388,-0.01818618,0.0338323,0.00093902997,-0.0567018,2,19.084194,15.607964,11
401,"in this session, we explored the variance inflation factor (vif) and principal component analysis (pca), focusing on their applications, differences, and use cases.

variance inflation factor (vif):

used to detect multicollinearity among features.
computed as 
vif=1/1-r^2, where r^2 is obtained by regressing a feature against all others.
a vif threshold of 10 (corresponding to r^2 = 0.9) is commonly used for feature elimination.
preserves real-world features, making it suitable for sensitivity analysis and interpretability in models.

principal component analysis (pca):

transforms features into new uncorrelated components (pcs) ranked by variance.
pc1 > pc2 > pc3 in terms of variance captured, with a decreasing trend in the explained variance graph.
common applications include dimensionality reduction, data visualization (e.g., pc1 vs. pc2 plots), and prediction modeling.
requires normalization to ensure fair variance contribution from all features.
unlike vif, pca does not retain original features, making sensitivity analysis difficult.

comparison:

vif works in feature space, removing redundant variables while keeping real-world interpretability.
pca creates mathematical features, making it more suitable for dimensionality reduction rather than feature selection.
vif is often preferred over pca when feature interpretability is essential.

additionally, the emnist dataset was mentioned as an example for handwritten digit classification using pca.

t-sne:  t-sne is a non-linear dimensionality reduction technique primarily used for visualizing high-dimensional data in a lower-dimensional space (typically 2d or 3d). 

how t-sne works:
measures similarity in high dimensions:
computes the probability that two points are neighbors in the original high-dimensional space using a gaussian distribution.
maps data to lower dimensions:
assigns similar points in a lower-dimensional space using a studentâ€™s t-distribution, ensuring that points that were close in high-dimensional space remain close.
optimizes for local structure:
unlike pca (which captures global variance), t-sne preserves local neighborhoods, making it great for cluster visualization.",0.005152112,-0.06471041,0.0013813914,0.030741245,0.08163646,0.01476858,-0.067757815,-0.01608598,0.04074431,0.0007346572,-0.008389371,-0.019361032,-0.07806561,0.08631883,-0.01865792,-0.026191024,0.10375847,0.052398887,-0.07698445,-0.03378572,0.038015485,-0.031838063,-0.057391535,0.038970415,0.030656785,0.0125561,-0.042776003,0.02251173,-0.0016689262,0.02570059,0.0044116997,0.0497747,-0.003579401,-0.028110314,-0.06469417,0.029911362,0.044634007,0.057103034,-0.09485454,-0.0062959287,-0.001200256,0.002077822,-0.022400217,0.036344174,0.14673412,-0.0028944423,-0.065632895,-0.06253151,0.023952018,-0.013446843,-0.04850629,-0.012840759,-0.06950408,0.035278577,0.002829102,0.008754036,-0.013024028,-0.037537824,0.04676509,-0.024935609,-0.024026198,-0.004345608,0.033001654,0.025180824,0.081809185,0.0020014984,0.00255636,-0.034191955,0.0026815496,0.008531042,-0.09100748,0.055774573,-0.048209473,-0.016518401,-0.0023510177,0.09685384,-0.037490945,0.0015069877,0.07945631,-0.008349228,0.04732825,0.06051267,-0.0070097935,-0.030332567,0.04288859,-0.017384557,0.0137694655,-0.07494576,-0.034728773,0.07043841,0.082752466,0.061440453,0.04954151,-0.0061681992,-0.04477871,-0.01011809,0.048900645,-0.084086016,-0.0003074903,0.0809342,-0.0045472793,-0.063845165,0.043352973,0.035905715,0.005882948,-0.05246583,-0.00943955,-0.012520224,0.01329147,-0.016109874,-0.045657724,0.009309071,-0.07718224,-0.032382213,0.038668666,0.01933407,0.039214134,0.040055275,0.07352289,0.051337186,-0.0006162697,-0.07024714,0.053178035,0.029589325,0.07219744,0.07252437,-0.07934585,7.125379e-33,0.024575396,0.014230074,-0.0022822462,-0.008652183,-0.04955329,-0.031518776,-0.0333118,-0.01763143,0.06483904,0.04122361,-0.001903907,0.07731601,-0.021225668,0.039949194,0.03209265,-0.0062292195,-0.008840034,0.017715536,0.031640593,-0.052322496,0.064039275,-0.063623235,0.045932505,-0.0013169188,-0.055644196,-0.04561605,-0.0821145,-0.0141806835,-0.052753292,-0.004182797,-0.05698836,0.06625167,-0.007078811,0.021269256,-0.09459623,-0.09742454,-0.008727447,-0.10332329,0.13699053,-0.0046453713,-0.015905682,-0.0067577376,0.027440906,-0.08423382,-0.037601642,0.022503976,0.06166946,-0.055967566,-0.045135118,0.021067336,-0.011203766,0.044393856,-0.0082976855,0.010401498,-0.052027237,0.071034834,0.06723487,-0.06880459,-0.0057233227,-0.018383022,-0.11472744,0.0455516,0.017675458,-0.061788976,-0.056068137,-0.038267605,-0.0070304396,0.060513236,-0.0567911,0.0063565173,-0.06511554,-0.0029271543,-0.022703765,-0.072769135,0.0031288022,-0.042756952,-0.013989881,0.010338971,0.0043639466,-0.041567404,-0.1024532,0.061629895,0.041923955,-0.011268909,0.005865381,-0.060957815,-0.020278092,-0.091186084,-0.02509569,-0.10770025,-0.008007999,0.07212114,0.09934797,-0.010030786,0.035969656,-6.565796e-33,-0.093571335,0.05698904,-0.03187583,0.10842018,0.013160978,-0.060860503,-0.047820818,-0.059833378,0.02282019,-0.095229216,0.023725316,-0.013911821,0.010545073,-0.008505672,0.07060737,0.06508179,-0.01539425,0.019732947,-0.032758404,-0.044492796,-0.0029856304,-0.034419283,-0.057086825,-0.008580493,-0.02625794,-0.048921723,-0.043882843,-0.09610101,-0.031413842,-0.03300795,-0.089397445,0.13441764,-0.031887244,0.02651234,0.0466971,-0.053555366,-0.05171532,-0.10532154,0.0057634846,0.07363826,0.09328629,0.102409475,0.018829012,0.028476035,-0.014125524,0.021739827,0.075964816,0.06157003,0.06323268,0.012449059,-0.0021121197,0.035789687,0.050633777,0.029797114,-0.020148158,0.027016416,0.0855255,-0.0301544,0.07563349,0.03470428,0.039070763,-0.012768389,-0.030638913,-0.040032938,0.014236049,0.0035819707,0.03838132,0.013653449,-0.0018226433,-0.023163022,0.08373944,-0.008647945,0.0025276989,-0.039927777,-0.047153767,-0.078143656,0.0072023976,-0.0022712308,-0.008639841,-0.00549137,0.035855334,-0.0008489926,0.074294,-0.069351755,-0.023954112,0.11035105,-0.011945519,-0.02890253,-0.008058953,-0.005503466,-0.049956627,0.02634317,-0.061138682,0.09784546,0.038734775,-4.9216418e-08,-0.063465044,-0.008575779,-0.041059446,-0.084220275,0.018761788,-0.06551754,0.03117691,0.10415908,0.004786261,0.013503131,0.13049035,-0.04600904,-0.1013936,0.01506942,0.06696664,0.095966324,0.03841156,0.078943856,-0.045848586,0.009565105,0.02607751,-0.0012188227,-0.0140260095,-0.07305117,0.08678571,-0.08145225,0.020802189,0.16941677,0.0893732,0.016012345,-0.0033069355,0.004666143,0.05579451,-0.006860778,0.024974862,0.108397014,0.07733792,-0.007991073,-0.047888916,0.06983133,-0.048795957,0.06889012,-0.08506582,-0.017871132,0.00065409986,0.05757222,0.034262955,-0.049559496,-0.0062204753,-0.0026470597,-0.037956297,-0.00540865,-0.02293732,0.089785084,0.038590267,0.039105278,-0.011205137,0.06125993,-0.0068268757,-0.024386534,0.0020880054,-0.05561975,-0.022071453,-0.025660776,2,16.684969,16.520678,11
421,"today we discussed a bit about vif and how a threshold should be selected with a reason. and we moved to pca, a technique that helps us reduce dimensionality. so in pca the pc axes are all orthogonal to each other, and they are linear combination of the initial features. pc1 has the highest variance, followed by pc2 and so on.
between vif and pca, vif ids thee one that should be done first as it gives an idea of the multicollinearity of the features that is more pressing to know and then pca can be used for visualization of the data.
there was another technique discussed for visualization, which was tsne, which gives a depiction in 2 dimensions. but this transformation is a lossy one. its comparatively slower as it is a stochastic process involving the t distribution.",0.052834816,-0.045629065,-0.048716873,-0.10549327,0.018071616,-0.025110524,-0.034503303,0.016582485,0.09237729,0.016584923,0.005614255,0.018544517,-0.06185708,0.042667195,-0.03208653,-0.05732659,0.07184838,0.039133377,-0.02514828,-0.009690422,0.009449435,-0.039524063,-0.030207716,-0.043839253,-0.02078558,0.008743087,0.018785678,0.026693275,0.013095765,0.012220658,-0.016016446,0.06431211,-0.016540896,-0.010939269,-0.072461545,-0.003993204,0.02324745,0.04789257,-0.06494154,-0.010429324,-0.04094599,0.0441268,-0.050489362,0.056268368,0.060735058,0.0076593626,-0.02746416,-0.09189705,0.028227642,-0.04393335,-0.070155144,-0.008016149,-0.07850191,0.007427389,-0.034200877,0.03590481,0.011464875,-0.10729038,0.044557832,0.02213197,0.012127834,0.02694792,0.07072486,0.033163305,0.13384631,0.0043933378,0.01524858,-0.014229802,0.0149919065,-0.011825211,-0.08640945,0.018478245,-0.07057569,-0.03324443,-0.06763283,0.033134606,-0.057005625,-0.015112576,0.03323018,-0.067352355,0.06798649,0.11114817,-0.010590758,0.052218203,-0.01302834,0.032374643,-0.006051084,-0.049052775,-0.021086115,0.012940713,0.060988463,0.06738131,0.014229503,-0.03803835,0.017521748,-0.07496191,0.063174985,-0.1393612,0.10603368,0.02785888,-0.03646071,-0.1177554,0.08028822,0.026936635,-0.0084418375,-0.072060004,0.022619348,-0.0033334678,0.026225636,-0.037290078,-0.028034465,0.07265878,-0.06836289,0.0003041232,0.063813664,0.023416335,-0.030451322,0.09973161,0.079033844,0.0031996572,-0.022126116,-0.060311098,-0.03982426,0.021573406,0.09022794,0.018149123,-0.030086044,2.6065305e-33,0.03433682,0.0062353928,-0.011246188,0.03126817,-0.006301363,0.013361534,-0.005288403,-0.1610295,0.057103198,0.10931872,-0.05094252,-0.005717949,0.06581781,0.081711486,0.025787313,-0.07892925,0.014902537,0.050577205,-0.041758344,-0.037344806,0.025451757,0.02737548,0.11922427,-0.0015262454,-0.024292605,-0.07706127,-0.12673797,-0.08675758,0.008030423,-0.012284738,-0.08996417,0.058823224,-0.058590446,-0.054116555,-0.021694696,-0.04624714,-0.0042186934,-0.06019594,0.07397789,-0.0021577072,0.025617402,0.027055068,0.029020026,-0.05484427,-0.04397488,0.045726158,0.032395136,0.010027125,-0.038071018,-0.0244465,0.016796317,0.0056541394,-0.047399186,-0.048573308,0.022885345,0.05193811,0.092124194,-0.09037687,-0.016210925,0.023002613,-0.04140287,-0.015516535,0.002188573,-0.036651585,-0.00037835774,-0.06450495,-0.064053945,-0.020438382,-0.0050078607,0.035626926,-0.045024276,0.03725459,-0.025132457,-0.08565827,0.028661126,0.01592737,-0.036804702,0.031611532,-0.0008628405,-0.010712328,-0.14928955,0.016473271,0.0048731975,-0.12103788,0.027332589,-0.044155434,0.04160905,-0.07292665,-0.043847468,-0.09010654,-0.033755034,0.053848233,0.071162194,-0.008426566,0.030520769,-4.7487073e-33,-0.10900356,0.081109755,0.011851362,0.068103805,0.012079169,-0.004856807,-0.02542124,-0.010055422,-0.02567948,0.008601176,0.0264067,-0.043123577,-0.0648684,-0.08897125,0.04299411,0.013871488,0.07609239,0.0047800886,-0.063528374,-0.089490354,0.022318365,0.00051984633,-0.03734241,-0.005020268,-0.004108084,0.004535574,-0.012627764,-0.055424377,-0.06424091,-0.021333907,-0.047274698,0.024677673,-0.007780845,0.093722396,0.064951815,0.022683026,0.026965728,-0.11442949,0.028015746,0.07282898,-0.0031238068,0.05641875,0.033386692,0.0547555,-0.08458319,0.0019300692,0.043070294,0.07437146,-0.0036243733,-0.01080829,0.051685564,0.11801179,0.06668583,-0.011505299,0.010593895,0.021000119,0.015120309,-0.06146237,0.063126326,0.023372693,0.045183476,-0.035996646,-0.05428691,0.0063608903,-0.011125464,-0.020604573,0.050681654,-0.008205501,-0.007886113,-0.027852494,0.083954096,0.0043553472,-0.012415522,-0.04066523,-0.0042915805,-0.16326539,0.0392667,0.016323656,0.00011271111,0.015744759,0.044434737,-0.02483171,0.06745837,0.014368622,-0.022142239,0.11399152,0.025570648,-0.08693735,0.075738326,0.00042828626,-0.0019152847,-0.035215896,-0.060776748,0.08293622,0.110370964,-5.0946934e-08,-0.077637926,-0.03637988,-0.014840199,-0.075428784,0.0561511,-0.05948822,0.024854697,0.13905166,0.0029510513,-0.010672861,0.026683407,-0.020566072,-0.08238993,-0.017816998,0.06465751,0.07330209,-0.008726708,0.0458549,0.007722405,0.030850122,0.0038318955,-0.005874251,-0.05071018,-0.050776888,-0.027884502,0.013670641,-0.024892876,0.06646384,0.023428317,0.012417567,0.01688581,-0.0047590034,0.05827457,0.013312772,0.015256018,-0.008297232,0.020013979,0.038372394,-0.08105053,0.04155939,-0.04503513,0.019534739,0.008858919,0.010797967,0.009819791,0.09609665,0.009020913,-0.007813782,0.04892131,-0.021692785,-0.024318755,0.00045760866,0.049273364,0.08995986,0.0014210938,0.038788557,-0.0074252943,0.07479916,0.01569003,-0.015652599,-0.022687798,-0.009398905,-0.032106202,-0.044019844,2,19.638826,13.544117,11
